v1,v2,v3,v4,v5
ham,Let me know if you need anything else. Salad or desert or something... How many beers shall i get?,,,
spam,"URGENT! Your Mobile No. was awarded å£2000 Bonus Caller Prize on 5/9/03 This is our final try to contact U! Call from Landline 09064019788 BOX42WR29C, 150PPM",,,
ham,Just hopeing that wasnÛ÷t too pissed up to remember and has gone off to his sisters or something!,,,
ham,Hanging out with my brother and his family,,,
spam,Thanks 4 your continued support Your question this week will enter u in2 our draw 4 å£100 cash. Name the NEW US President? txt ans to 80082,,,
ham,Where r e meeting tmr?,,,
spam,"Free-message: Jamster!Get the crazy frog sound now! For poly text MAD1, for real text MAD2 to 88888. 6 crazy sounds for just 3 GBP/week! 16+only! T&C's apply",,,
ham,I want to send something that can sell fast.  &lt;#&gt; k is not easy money.,,,
ham,Ok... Then r we meeting later?,,,
ham,"GOD ASKED, \What is forgiveness?\"" A little child gave lovely reply",,,
ham,Yes.he have good crickiting mind,,,
ham,I will see in half an hour,,,
spam,Want 2 get laid tonight? Want real Dogging locations sent direct 2 ur mob? Join the UK's largest Dogging Network bt Txting GRAVEL to 69888! Nt. ec2a. 31p.msg@150p,,,
ham,Ok i've sent u da latest version of da project.,,,
ham,"Hey there! Glad u r better now. I hear u treated urself to a digi cam, is it good? We r off at 9pm. Have a fab new year, c u in coupla wks!",,,
ham,I'm in a movie... Collect car oredi...,,,
ham,"Yup, leaving right now, be back soon",,,
ham,You should get more chicken broth if you want ramen unless there's some I don't know about,,,
ham,"Согласование прошло успешно, можем приступать к следующему этапу",,,
ham,Prabha..i'm soryda..realy..frm heart i'm sory,,,
ham,Its a part of checking IQ,,,
ham,Nite...,,,
ham,How many times i told in the stage all use to laugh. You not listen aha.,,,
ham,ok....take care.umma to you too...,,,
ham,"Can you pls pls send me a mail on all you know about relatives coming to deliver here? All you know about costs, risks, benefits and anything else. Thanks.",,,
spam,Great NEW Offer - DOUBLE Mins & DOUBLE Txt on best Orange tariffs AND get latest camera phones 4 FREE! Call MobileUpd8 free on 08000839402 NOW! or 2stoptxt T&Cs,,,
ham,Haha okay... Today weekend leh... ,,,
ham,Ok then i will come to ur home after half an hour,,,
spam,Todays Voda numbers ending 7548 are selected to receive a $350 award. If you have a match please call 08712300220 quoting claim code 4041 standard rates app,,,
ham,K..give back my thanks.,,,
ham,Hey are you angry with me. Reply me dr.,,,
ham,"Kind of. Just missed train cos of asthma attack, nxt one in half hr so driving in. not sure where to park.",,,
ham,at bruce b downs &amp; fletcher now,,,
ham,Guessin you ain't gonna be here before 9?,,,
ham,"So anyways, you can just go to your gym or whatever, my love *smiles* I hope your ok and having a good day babe ... I miss you so much already",,,
ham,Quite lor. But dun tell him wait he get complacent...,,,
ham,Wait  &lt;#&gt;  min..,,,
ham,Dude ive been seeing a lotta corvettes lately,,,
ham,"Doing nothing, then u not having dinner w us?",,,
ham,"Thk shld b can... Ya, i wana go 4 lessons... Haha, can go for one whole stretch...",,,
ham,Just got outta class gonna go gym.,,,
ham,Da is good good player.why he is unsold.,,,
ham,Ha... Both of us doing e same thing. But i got tv 2 watch. U can thk of where 2 go tonight or u already haf smth in mind...,,,
ham,K.k.how is your business now?,,,
ham,Oh is it? Send me the address,,,
ham,Hey mate. Spoke to the mag people. WeÛ÷re on.  the is deliver by the end of the month. Deliver on the 24th sept. Talk later. ,,,
ham,Was playng 9 doors game and gt racing on phone lol,,,
ham,Was the farm open?,,,
ham,Speaking of does he have any cash yet?,,,
ham,Po de :-):):-):-):-). No need job aha.,,,
ham,"She said,'' do u mind if I go into the bedroom for a minute ? '' ''OK'', I sed in a sexy mood. She came out 5 minuts latr wid a cake...n My Wife,",,,
ham,"Nothing, i got msg frm tht unknown no..",,,
ham,"My friend just got here and says he's upping his order by a few grams (he's got $ &lt;#&gt; ), when can you get here?",,,
ham,Am i that much dirty fellow?,,,
ham,You didnt complete your gist oh.,,,
spam,December only! Had your mobile 11mths+? You are entitled to update to the latest colour camera mobile for Free! Call The Mobile Update Co FREE on 08002986906,,,
ham,Really dun bluff me leh... U sleep early too. Nite...,,,
ham,"Good afternoon, my love ! Any job prospects ? Are you missing me ? What do you do ? Are you being lazy and bleak, hmmm ? Or happy and filled with my love ?",,,
ham,No objection. My bf not coming.,,,
ham,I absolutely LOVE South Park! I only recently started watching the office.,,,
ham,Shuhui say change 2 suntec steamboat? U noe where? Where r u now?,,,
spam,FREE for 1st week! No1 Nokia tone 4 ur mob every week just txt NOKIA to 8007 Get txting and tell ur mates www.getzed.co.uk POBox 36504 W45WQ norm150p/tone 16+,,,
ham,HEY MATE! HOWS U HONEY?DID U AVE GOOD HOLIDAY? GIMMI DE GOSS!x,,,
ham,G.W.R,,,
ham,"That means you got an A in epi, she.s fine. She.s here now.",,,
ham,How will I creep on you now? ;_;,,,
spam,Someone has conacted our dating service and entered your phone because they fancy you!To find out who it is call from landline 09111030116. PoBox12n146tf15,,,
ham,I cant wait to see you! How were the photos were useful? :),,,
spam,Ваша карта Visa будет заблокирована через 6 часов! Подтвердить: visa-check.net,,,
ham,"Экзамен сдал на отлично, родители довольны!",,,
spam,T-Mobile customer you may now claim your FREE CAMERA PHONE upgrade & a pay & go sim card for your loyalty. Call on 0845 021 3680.Offer ends 28thFeb.T&C's apply,,,
spam,Not heard from U4 a while. Call 4 rude chat private line 01223585334 to cum. Wan 2C pics of me gettin shagged then text PIX to 8552. 2End send STOP 8552 SAM xxx,,,
ham,Slept? I thinkThis time ( &lt;#&gt;  pm) is not dangerous,,,
ham,I cant pick the phone right now. Pls send a message,,,
spam,"Did you hear about the new \Divorce Barbie\""? It comes with all of Ken's stuff!""",,,
ham,He neva grumble but i sad lor... Hee... Buy tmr lor aft lunch. But we still meetin 4 lunch tmr a not. Neva hear fr them lei. ÌÏ got a lot of work ar?,,,
ham,Thanks for looking out for me. I really appreciate.,,,
spam,Bored housewives! Chat n date now! 0871750.77.11! BT-national rate 10p/min only from landlines!,,,
ham,If you're thinking of lifting me one then no.,,,
ham,O. Guess they both got screwd,,,
ham,If you don't respond imma assume you're still asleep and imma start calling n shit,,,
ham,I went to project centre,,,
ham,The wine is flowing and i'm i have nevering..,,,
ham,Cant think of anyone with * spare room off * top of my head,,,
ham,I cant pick the phone right now. Pls send a message,,,
ham,"No, but you told me you were going, before you got drunk!",,,
ham,i want to grasp your pretty booty :),,,
ham,Stupid auto correct on my phone,,,
ham,K...k:)why cant you come here and search job:),,,
ham,You could have seen me..i did't recognise you Face.:),,,
ham,Wat u doing there?,,,
ham,Did he just say somebody is named tampa,,,
ham,Message from . I am at Truro Hospital on ext. You can phone me here. as I have a phone by my side,,,
ham,I'm not. She lip synced with shangela.,,,
spam,"Double mins and txts 4 6months FREE Bluetooth on Orange. Available on Sony, Nokia Motorola phones. Call MobileUpd8 on 08000839402 or call2optout/N9DX",,,
ham,Keep my payasam there if rinu brings,,,
ham,In xam hall boy asked girl Tell me the starting term for dis answer I can den manage on my own After lot of hesitation n lookin around silently she said THE! intha ponnungale ipaditan;),,,
ham,Aiyah u did ok already lar. E nydc at wheellock?,,,
ham,"What do u reckon as need 2 arrange transport if u can't do it, thanks",,,
ham,Thanks for ve lovely wisheds. You rock,,,
ham,Lol for real. She told my dad I have cancer,,,
ham,"Whatever, juliana. Do whatever you want.",,,
ham,Yes i have. So that's why u texted. Pshew...missing you so much,,,
spam,БЕСПЛАТНАЯ раздача денег! Первым 100 участникам по 10000 руб! Регистрация тут: free-money24.ru,,,
ham,How have your little darlings been so far this week? Need a coffee run tomo?Can't believe it's that time of week already Û_,,,
ham,Tell me again what your address is,,,
ham,"Pls send me a comprehensive mail about who i'm paying, when and how much.",,,
ham,Boo. How's things? I'm back at home and a little bored already :-(,,,
ham,In that case I guess I'll see you at campus lodge,,,
ham,Let me know when you've got the money so carlos can make the call,,,
ham,1's reach home call me.,,,
ham,K:)i will give my kvb acc details:),,,
ham,"What part of \don't initiate\"" don't you understand""",,,
ham,No calls..messages..missed calls,,,
ham,"Yo, I'm at my parents' gettin cash. Good news: we picked up a downstem",,,
spam,Dear Subscriber ur draw 4 å£100 gift voucher will b entered on receipt of a correct ans. When was Elvis Presleys Birthday? TXT answer to 80062,,,
ham,Can. Dunno wat to get 4 her...,,,
ham,It's justbeen overa week since we broke up and already our brains are going to mush!,,,
ham,Thanks. It was only from tescos but quite nice. All gone now. Speak soon ,,,
ham,Sitting in mu waiting for everyone to get out of my suite so I can take a shower,,,
ham,I'm okay. Chasing the dream. What's good. What are you doing next.,,,
ham,Can not use foreign stamps in this country. Good lecture .,,,
ham,"IÛ÷ll leave around four, ok?",,,
ham,"How are you, my Love ? Are you with your brother ? Time to talk english with him ? *grins* Say : Hey Muhommad, Penny says hello from across the sea",,,
ham,"Aight I've been set free, think you could text me blake's address? It occurs to me I'm not quite as sure what I'm doing as I thought I was",,,
ham,how are you? I miss you!,,,
ham,Okie...,,,
ham,That's cause your old. I live to be high.,,,
ham,We can make a baby in yo tho,,,
spam,Well done ENGLAND! Get the official poly ringtone or colour flag on yer mobile! text TONE or FLAG to 84199 NOW! Opt-out txt ENG STOP. Box39822 W111WX å£1.50,,,
ham,Anytime lor...,,,
ham,Dont know supports ass and srt i thnk. I think ps3 can play through usb too,,,
ham,Nothing will ever be easy. But don't be looking for a reason not to take a risk on life and love,,,
ham,Saw Guys and Dolls last night with Patrick Swayze it was great,,,
ham,"I shall book chez jules for half eight, if that's ok with you?",,,
ham,"Dont give a monkeys wot they think and i certainly don't mind. Any friend of mine&all that! Just don't sleep wiv , that wud be annoyin!",,,
ham,\HI BABE UAWAKE?FEELLIKW SHIT.JUSTFOUND OUT VIA ALETTER THATMUM GOTMARRIED 4thNOV.BEHIND OURBACKS åÐ FUCKINNICE!SELFISH,,,
spam,Hi 07734396839 IBH Customer Loyalty Offer: The NEW NOKIA6600 Mobile from ONLY å£10 at TXTAUCTION!Txt word:START to No:81151 & get Yours Now!4T&,,,
ham,"Guy, no flash me now. If you go call me, call me. How madam. Take care oh.",,,
ham,Oic... Then better quickly go bathe n settle down...,,,
ham,ÌÏ come lt 25 n pass to me lar,,,
ham,Are you coming to day for class.,,,
ham,Новый пароль от WiFi: HomeNetwork2024,,,
ham,But your brother transfered only  &lt;#&gt;  +  &lt;#&gt; . Pa.,,,
ham,Don no da:)whats you plan?,,,
ham,Its too late:)but its k.wish you the same.,,,
ham,Where are you lover ? I need you ...,,,
ham,You should know now. So how's anthony. Are you bringing money. I've school fees to pay and rent and stuff like that. Thats why i need your help. A friend in need....|,,,
spam,ВАЖНО! Ваша подписка продлена автоматически! Отменить: unsubscribe-service.ru,,,
ham,Please don't text me anymore. I have nothing else to say.,,,
ham,No go. No openings for that room 'til after thanksgiving without an upcharge.,,,
ham,Men like shorter ladies. Gaze up into his eyes.,,,
spam,URGENT We are trying to contact you Last weekends draw shows u have won a å£1000 prize GUARANTEED Call 09064017295 Claim code K52 Valid 12hrs 150p pm,,,
ham,This is ur face test ( 1 2 3 4 5 6 7 8 9  &lt;#&gt;  ) select any number i will tell ur face astrology.... am waiting. quick reply...,,,
ham,Eh sorry leh... I din c ur msg. Not sad already lar. Me watching tv now. U still in office?,,,
ham,Ball is moving a lot.will spin in last :)so very difficult to bat:),,,
ham,G wants to know where the fuck you are,,,
ham,Are you staying in town ?,,,
ham,He's an adult and would learn from the experience. There's no real danger. I just dont like peeps using drugs they dont need. But no comment,,,
ham,No da:)he is stupid da..always sending like this:)don believe any of those message.pandy is a mental:),,,
ham,Friendship poem: Dear O Dear U R Not Near But I Can Hear Dont Get Fear Live With Cheer No More Tear U R Always my Dear. Gud ni8,,,
spam,Buy Space Invaders 4 a chance 2 win orig Arcade Game console. Press 0 for Games Arcade (std WAP charge) See o2.co.uk/games 4 Terms + settings. No purchase,,,
ham,Wat so late still early mah. Or we juz go 4 dinner lor. Aiya i dunno...,,,
spam,"Update_Now - Xmas Offer! Latest Motorola, SonyEricsson & Nokia & FREE Bluetooth! Double Mins & 1000 Txt on Orange. Call MobileUpd8 on 08000839402 or call2optout/F4Q=",,,
ham,You will be in the place of that man,,,
ham,How dare you stupid. I wont tell anything to you. Hear after i wont talk to you:-.,,,
ham,Of course. I guess god's just got me on hold right now.,,,
ham,"Y cant u try new invention to fly..i'm not joking.,",,,
ham,"Same, I'm at my great aunts anniversary party in tarpon springs",,,
ham,Is that what time you want me to come?,,,
ham,Oi when you gonna ring,,,
spam,"England v Macedonia - dont miss the goals/team news. Txt ur national team to 87077 eg ENGLAND to 87077 Try:WALES, SCOTLAND 4txt/Ì¼1.20 POBOXox36504W45WQ 16+",,,
ham,Dear good morning now only i am up,,,
spam,Great NEW Offer - DOUBLE Mins & DOUBLE Txt on best Orange tariffs AND get latest camera phones 4 FREE! Call MobileUpd8 free on 08000839402 NOW! or 2stoptxt T&Cs,,,
ham,Have a good evening! Ttyl,,,
ham,I have to take exam with march 3,,,
spam,"New Mobiles from 2004, MUST GO! Txt: NOKIA to No: 89545 & collect yours today! From ONLY å£1. www.4-tc.biz 2optout 087187262701.50gbp/mtmsg18 TXTAUCTION.",,,
spam,Вам начислен кешбэк 3500 рублей! Для получения введите данные карты на site-cashback.net,,,
ham,Wake me up at  &lt;#&gt;  am morning:),,,
ham,"Awesome question with a cute answer: Someone asked a boy \how is ur life?\"" . . He smiled &amp; answered: . . \""She is fine!\"" Gudnite""",,,
ham,U really pig leh sleep so much. My dad wake me up at 10 smth 2 eat lunch today.,,,
ham,Tell them u have a headache and just want to use 1 hour of sick time.,,,
ham,What time you thinkin of goin?,,,
ham,He's really into skateboarding now despite the fact that he gets thrown off of it and winds up with bandages and shit all over his arms every five minutes,,,
ham,I will reach ur home in  &lt;#&gt;  minutes,,,
spam,We currently have a message awaiting your collection. To collect your message just call 08718723815.,,,
ham,"\Hi its Kate it was lovely to see you tonight and ill phone you tomorrow. I got to sing and a guy gave me his card! xxx\""""",,,
ham, and  picking them up from various points,,,
ham,Nope watching tv at home... Not going out. V bored...,,,
ham,Ok no prob... I'll come after lunch then...,,,
spam,ВНИМАНИЕ! Ваши фото попали в интернет! Удалить срочно: delete-photos.com,,,
ham,What's nannys address?,,,
spam,"Your account has been credited with 500 FREE Text Messages. To activate, just txt the word: CREDIT to No: 80488 T&Cs www.80488.biz",,,
ham,I love to wine and dine my lady!,,,
ham,What happened to our yo date?,,,
ham,I am in escape theatre now. . Going to watch KAVALAN in a few minutes,,,
ham,Mm umma ask vava also to come tell him can play later together,,,
spam,"Congrats! 2 mobile 3G Videophones R yours. call 09061744553 now! videochat wid ur mates, play java games, Dload polyH music, noline rentl. bx420. ip4. 5we. 150pm",,,
ham,"Good afternoon, my boytoy ... How are you feeling today ? Better I hope? Are you being my good boy? Are you my obedient, slave? Do you please your Queen?",,,
spam,PRIVATE! Your 2003 Account Statement for shows 800 un-redeemed S. I. M. points. Call 08719899230 Identifier Code: 41685 Expires 07/11/04,,,
spam,Your credits have been topped up for http://www.bubbletext.com Your renewal Pin is tgxxrz,,,
ham,"Посылка пришла, можешь забрать из почтового отделения",,,
ham,Just finished. Missing you plenty,,,
ham,HI DARLIN ITS KATE ARE U UP FOR DOIN SOMETHIN TONIGHT? IM GOING TO A PUB CALLED THE SWAN OR SOMETHING WITH MY PARENTS FOR ONE DRINK SO PHONE ME IF U CAN,,,
ham,You've always been the brainy one.,,,
ham,Easy ah?sen got selected means its good..,,,
ham,They will pick up and drop in car.so no problem..,,,
ham,For real tho this sucks. I can't even cook my whole electricity is out. And I'm hungry.,,,
ham,Ha ha cool cool chikku chikku:-):-DB-),,,
ham,Er mw im filled tuth is aight,,,
ham,Even if he my friend he is a priest call him now,,,
ham,Tell your friends what you plan to do on Valentines day @ &lt;URL&gt;,,,
ham,"I got another job! The one at the hospital doing data analysis or something, starts on monday! Not sure when my thesis will got finished",,,
ham,I had askd u a question some hours before. Its answer,,,
ham,"Call me when you/carlos is/are here, my phone's vibrate is acting up and I might not hear texts",,,
ham,Stupid.its not possible,,,
ham,Wat Ì_ doing now?,,,
ham,Ok...,,,
ham,"Evening * v good if somewhat event laden. Will fill you in, don't you worry Û_ Head * ok but throat * wrecked. See you at six then!",,,
ham,Its good to hear from you,,,
ham,Sounds great! Are you home now?,,,
ham,Me sef dey laugh you. Meanwhile how's my darling anjie!,,,
ham,Raji..pls do me a favour. Pls convey my Birthday wishes to Nimya. Pls. Today is her birthday.,,,
ham,", ow u dey.i paid 60,400thousad.i told  u would call . ",,,
ham,Nt yet chikku..simple habba..hw abt u?,,,
ham,Gud ni8.swt drms.take care,,,
ham,Please ask mummy to call father,,,
spam,"Hey Boys. Want hot XXX pics sent direct 2 ur phone? Txt PORN to 69855, 24Hrs free and then just 50p per day. To stop text STOPBCM SF WC1N3XX",,,
ham,Don't forget who owns you and who's private property you are ... And be my good boy always .. *passionate kiss*,,,
ham,Did u got that persons story,,,
ham,WHORE YOU ARE UNBELIEVABLE.,,,
ham,"Urgh, coach hot, smells of chip fat! Thanks again, especially for the duvet (not a predictive text word).",,,
ham,"Hey sweet, I was wondering when you had a moment if you might come to me ? I want to send a file to someone but it won't go over yahoo for them because their connection sucks, remember when you set up that page for me to go to and download the format disc ? Could you tell me how to do that ? Or do you know some other way to download big files ? Because they can download stuff directly from the internet. Any help would be great, my prey ... *teasing kiss*",,,
ham,"\Im on gloucesterroad what are uup to later?\""""",,,
ham,Desires- u going to doctor 4 liver. And get a bit stylish. Get ur hair managed. Thats it.,,,
ham,Then u drive lor.,,,
ham,Its  &lt;#&gt; k here oh. Should i send home for sale.,,,
ham,Y dun cut too short leh. U dun like ah? She failed. She's quite sad.,,,
ham,"I had been hoping i would not have to send you this message. My rent is due and i dont have enough for it. My reserves are completely gone. Its a loan i need and was hoping you could her. The balance is  &lt;#&gt; . Is there a way i could get that from you, till mid march when i hope to pay back.",,,
ham,I will be gentle princess! We will make sweet gentle love...,,,
spam,You have 1 new voicemail. Please call 08719181513.,,,
ham,Love it! Daddy will make you scream with pleasure! I am going to slap your ass with my dick!,,,
ham,Reason is if the team budget is available at last they buy the unsold players for at base rate..,,,
ham,Yep. I do like the pink furniture tho.,,,
ham,Then get some cash together and I'll text jason,,,
ham,The fact that you're cleaning shows you know why i'm upset. Your priority is constantly \what i want to do,,,
ham,Got c... I lazy to type... I forgot Ì_ in lect... I saw a pouch but like not v nice...,,,
ham,No management puzzeles.,,,
spam,Ringtone Club: Gr8 new polys direct to your mobile every week !,,,
ham,What time. IÛ÷m out until prob 3 or so,,,
ham,Not a drop in the tank,,,
ham,No sir. That's why i had an 8-hr trip on the bus last week. Have another audition next wednesday but i think i might drive this time.,,,
ham,Me fine..absolutly fine,,,
ham,Well I wasn't available as I washob nobbing with last night so they had to ask Nickey Platt instead of me!;,,,
ham,"Sorry, I'll call later ok bye",,,
ham,Me hungry buy some food good lei... But mum n yun dun wan juz buy a little bit... ,,,
ham,Crucify is c not s. You should have told me earlier.,,,
ham,"fyi I'm at usf now, swing by the room whenever",,,
ham,"I met you as a stranger and choose you as my friend. As long as the world stands, our friendship never ends. Lets be Friends forever!!! Gud nitz...",,,
ham,I want to be there so i can kiss you and feel you next to me,,,
ham,He says hi and to get your ass back to south tampa (preferably at a kegger),,,
ham,hanks lotsly!,,,
ham,"I know where the  &lt;#&gt;  is, I'll be there around 5",,,
ham,We have to pick rayan macleran there.,,,
ham,"That way transport is less problematic than on sat night. By the way, if u want to ask  n  to join my bday, feel free. But need to know definite nos as booking on fri. ",,,
spam,Double your mins & txts on Orange or 1/2 price linerental - Motorola and SonyEricsson with B/Tooth FREE-Nokia FREE Call MobileUpd8 on 08000839402 or2optout/HV9D,,,
ham,Ok...,,,
ham,Just glad to be talking to you.,,,
ham,Well i will watch shrek in 3D!!B),,,
ham,Onum ela pa. Normal than.,,,
ham,"Haha... Sounds crazy, dunno can tahan anot...",,,
ham,Yay! You better not have told that to 5 other girls either.,,,
ham,haha but no money leh... Later got to go for tuition... Haha and looking for empty slots for driving lessons,,,
ham,Thanks for this hope you had a good day today,,,
spam,Bored housewives! Chat n date now! 0871750.77.11! BT-national rate 10p/min only from landlines!,,,
ham,No messages on her phone. I'm holding it now,,,
ham,You need to get up. Now.,,,
ham,Wewa is 130. Iriver 255. All 128 mb.,,,
ham,How to Make a girl Happy? It's not at all difficult to make girls happy. U only need to be... 1. A friend 2. Companion 3. Lover 4. Chef . . .  &lt;#&gt; . Good listener  &lt;#&gt; . Organizer  &lt;#&gt; . Good boyfriend  &lt;#&gt; . Very clean  &lt;#&gt; . Sympathetic  &lt;#&gt; . Athletic  &lt;#&gt; . Warm . . .  &lt;#&gt; . Courageous  &lt;#&gt; . Determined  &lt;#&gt; . True  &lt;#&gt; . Dependable  &lt;#&gt; . Intelligent . . .  &lt;#&gt; . Psychologist  &lt;#&gt; . Pest exterminator  &lt;#&gt; . Psychiatrist  &lt;#&gt; . Healer . .  &lt;#&gt; . Stylist  &lt;#&gt; . Driver . . Aaniye pudunga venaam..,,,
ham,:( but your not here....,,,
ham,Mm i had my food da from out,,,
ham,"Each Moment in a day,has its own value-Morning brings hope,afternoon brings faith,Evening brings luv,Night brings rest,Wish u find them all today.Good Morning",,,
spam,tells u 2 call 09066358152 to claim å£5000 prize. U have 2 enter all ur mobile & personal details @ the prompts. Careful!,,,
ham,So its to be poking man everyday that they teach you in canada abi! How are you. Just saying hi.,,,
ham,Ok. No wahala. Just remember that a friend in need ...,,,
ham,Ok k..sry i knw 2 siva..tats y i askd..,,,
ham,"Aight will do, thanks again for comin out",,,
ham,Well good morning mr . Hows london treatin' ya treacle?,,,
spam,You are awarded a SiPix Digital Camera! call 09061221061 from landline. Delivery within 28days. T Cs Box177. M221BP. 2yr warranty. 150ppm. 16 . p på£3.99,,,
spam,<Forwarded from 21870000>Hi - this is your Mailbox Messaging SMS alert. You have 40 matches. Please call back on 09056242159 to retrieve your messages and matches cc100p/min,,,
ham,I'm watching lotr w my sis dis aft. So u wan 2 meet me 4 dinner at nite a not?,,,
ham,Hi :)finally i completed the course:),,,
ham,HOW ARE U? I HAVE MISSED U! I HAVENT BEEN UP 2 MUCH A BIT BORED WITH THE HOLIDAY WANT 2 GO BAK 2 COLLEGE! SAD ISNT IT?xx,,,
ham,I ask if u meeting da ge tmr nite...,,,
ham,Yup but it's not giving me problems now so mayb i'll jus leave it...,,,
ham,"When you just put in the + sign, choose my number and the pin will show. Right?",,,
ham,"New Theory: Argument wins d SITUATION, but loses the PERSON. So dont argue with ur friends just.. . . . kick them &amp; say, I'm always correct.!",,,
ham,Aslamalaikkum....insha allah tohar beeen muht albi mufti mahfuuz...meaning same here....,,,
ham,Aight sorry I take ten years to shower. What's the plan?,,,
spam,8007 FREE for 1st week! No1 Nokia tone 4 ur mob every week just txt NOKIA to 8007 Get txting and tell ur mates www.getzed.co.uk POBox 36504 W4 5WQ norm 150p/tone 16+,,,
ham,"Customer place, i wil cal u sir.",,,
ham,No * am working on the ringing u thing but have whole houseful of screaming brats so * am pulling my hair out! Loving u,,,
spam,83039 62735=å£450 UK Break AccommodationVouchers terms & conditions apply. 2 claim you mustprovide your claim number which is 15541 ,,,
ham,Happy birthday... May all ur dreams come true...,,,
ham,Hows the pain dear?y r u smiling?,,,
ham,"Awesome, that gonna be soon or later tonight?",,,
ham,"Pity, * was in mood for that. So...any other suggestions?",,,
