v1,v2,v3,v4,v5
ham,Do you know where my lab goggles went,,,
ham,Dad went out oredi... ,,,
ham,Waiting in e car 4 my mum lor. U leh? Reach home already?,,,
ham,Horrible gal. Me in sch doing some stuff. How come u got mc?,,,
ham,Should i send you naughty pix? :),,,
ham,Ok ill send you with in  &lt;DECIMAL&gt;  ok.,,,
ham,I don't quite know what to do. I still can't get hold of anyone. I cud pick you up bout 7.30pm and we can see if they're in the pub?,,,
ham,Pass dis to all ur contacts n see wat u get! Red;i'm in luv wid u. Blue;u put a smile on my face. Purple;u r realy hot. Pink;u r so swt. Orange;i thnk i lyk u. Green;i realy wana go out wid u. Yelow;i wnt u bck. Black;i'm jealous of u. Brown;i miss you Nw plz giv me one color,,,
ham,"Good morning, im suffering from fever and dysentry ..will not be able to come to office today.",,,
spam,Sunshine Quiz Wkly Q! Win a top Sony DVD player if u know which country the Algarve is in? Txt ansr to 82277. å£1.50 SP:Tyrone,,,
ham,My drive can only be read. I need to write,,,
ham,The length is e same but e top shorter n i got a fringe now. I thk i'm not going liao. Too lazy. Dun wan 2 distract u also.,,,
ham,I accidentally deleted the message. Resend please.,,,
ham,Bishan lar nearer... No need buy so early cos if buy now i gotta park my car...,,,
ham,"Beautiful Truth against Gravity.. Read carefully: \Our heart feels light when someone is in it.. But it feels very heavy when someone leaves it..\"" GOODMORNING""",,,
ham,Ya srsly better than yi tho,,,
ham,Send me yetty's number pls.,,,
ham,Jesus christ bitch I'm trying to give you drugs answer your fucking phone,,,
ham,Mine here like all fr china then so noisy.,,,
ham,K...k...when will you give treat?,,,
spam,ВЫГОДНОЕ предложение! Займ за 5 минут! Одобрение 99%! Звони 8-XXX-XXX-XXXX,,,
ham,Hey i'm bored... So i'm thinking of u... So wat r u doing?,,,
ham,Hi Petey!noiåÕm ok just wanted 2 chat coz avent spoken 2 u 4 a long time-hope ur doin alrite.have good nit at js love ya am.x,,,
ham,Go where n buy? Juz buy when we get there lar.,,,
ham,Did u fix the teeth?if not do it asap.ok take care.,,,
spam,ВНИМАНИЕ ВОДИТЕЛИ! Штрафы ГИБДД списаны! Проверь на gibdd-info.ru,,,
ham,Having lunch:)you are not in online?why?,,,
ham,* Am on my way,,,
ham,Did you stitch his trouser,,,
ham,I wud never mind if u dont miss me or if u dont need me.. But u wil really hurt me wen u need me &amp; u dont tell me......... Take care:-),,,
ham,"Sorry about earlier. Putting out fires.Are you around to talk after 9? Or do you actually have a life, lol!",,,
ham,You call times job today ok umma and ask them to speed up,,,
ham,"Hi, Mobile no.  &lt;#&gt;  has added you in their contact list on www.fullonsms.com It s a great place to send free sms to people For more visit fullonsms.com",,,
ham,What can i do? Might accidant tookplace between somewhere ghodbandar rd. Traffic moves slovely. So plz slip &amp; don't worry.,,,
ham,But i juz remembered i gotta bathe my dog today..,,,
ham,A cute thought for friendship: \Its not necessary to share every secret with ur close Frnd,,,
ham,Your pussy is perfect!,,,
ham,I keep ten rs in my shelf:) buy two egg.,,,
ham,"Just wondering, the others just took off",,,
ham,"Daddy, shu shu is looking 4 u... U wan me 2 tell him u're not in singapore or wat?",,,
ham,Oh k. . I will come tomorrow,,,
ham,Nooooooo I'm gonna be bored to death all day. Cable and internet outage.,,,
spam,"If you don't, your prize will go to another customer. T&C at www.t-c.biz 18+ 150p/min Polo Ltd Suite 373 London W1J 6HL Please call back if busy",,,
ham,That's my honeymoon outfit. :),,,
ham,Yeah I imagine he would be really gentle. Unlike the other docs who treat their patients like turkeys.,,,
ham,"1) Go to write msg 2) Put on Dictionary mode 3)Cover the screen with hand, 4)Press  &lt;#&gt; . 5)Gently remove Ur hand.. Its interesting..:)",,,
ham,Well you told others you'd marry them...,,,
ham,"Not really dude, have no friends i'm afraid :(",,,
spam,"Spook up your mob with a Halloween collection of a logo & pic message plus a free eerie tone, txt CARD SPOOK to 8007 zed 08701417012150p per logo/pic ",,,
ham,Just haven't decided where yet eh ?,,,
ham,Dont flatter yourself... Tell that man of mine two pints of carlin in ten minutes please.... ,,,
ham,it's really getting me down just hanging around.,,,
ham,Am in film ill call you later.,,,
ham,I got your back! Do you have any dislikes in bed?,,,
ham,Same as kallis dismissial in 2nd test:-).,,,
ham,"Oops, I'll let you know when my roommate's done",,,
ham,Ok lor but not too early. Me still having project meeting now.,,,
ham,"Night night, see you tomorrow",,,
ham,Is it your yahoo boys that bring in the perf? Or legal.,,,
ham,Eh u send wrongly lar...,,,
ham,LOOK AT THE FUCKIN TIME. WHAT THE FUCK YOU THINK IS UP,,,
ham,Ok cool. See ya then.,,,
ham,Lmao. Take a pic and send it to me.,,,
ham,"Just got some gas money, any chance you and the gang want to go on a grand nature adventure?",,,
ham,have you ever had one foot before?,,,
ham,The greatest test of courage on earth is to bear defeat without losing heart....gn tc,,,
ham,Convey my regards to him,,,
spam,Получи деньги прямо сейчас! Без проверок! Без отказов! Оформи заявку: money-fast.com,,,
ham,"Geeee ... I miss you already, you know ? Your all I can think about. Fuck, I can't wait till next year when we will be together ... *loving kiss*",,,
ham,I got a call from a landline number. . . I am asked to come to anna nagar . . . I will go in the afternoon,,,
ham,"Alright, we're all set here, text the man",,,
ham,Eat jap done oso aft ur lect wat... ÌÏ got lect at 12 rite... ,,,
ham,"Hello, hello, hi lou sorry it took so long 2 reply- I left mobile at friends in Lancaster, just got it bak Neway im sorry I couldnåÕt make ur båÕday 2 hun!",,,
ham,i dnt wnt to tlk wid u,,,
ham,R u over scratching it?,,,
ham,Well. You know what i mean. Texting,,,
ham,Mystery solved! Just opened my email and he's sent me another batch! Isn't he a sweetie,,,
ham,"Ugh y can't u just apologize, admit u were wrong and ask me to take u back?",,,
ham,Nutter. Cutter. Ctter. Cttergg. Cttargg. Ctargg. Ctagg. ie you,,,
ham,Ok i wont call or disturb any one. I know all are avoiding me. I am a burden for all,,,
ham,Aah! A cuddle would be lush! I'd need lots of tea and soup before any kind of fumbling!,,,
spam,Free entry in 2 a wkly comp to win FA Cup final tkts 21st May 2005. Text FA to 87121 to receive entry question(std txt rate)T&C's apply 08452810075over18's,,,
ham,Lara said she can loan me  &lt;#&gt; .,,,
spam,"Today's Offer! Claim ur å£150 worth of discount vouchers! Text YES to 85023 now! SavaMob, member offers mobile! T Cs 08717898035. å£3.00 Sub. 16 . Unsub reply X",,,
ham,Hi Chachi tried calling u now unable to reach u .. Pl give me a missed cal once u c tiz msg  Kanagu,,,
ham,He is world famamus....,,,
spam,New TEXTBUDDY Chat 2 horny guys in ur area 4 just 25p Free 2 receive Search postcode or at gaytextbuddy.com. TXT ONE name to 89693. 08715500022 rpl Stop 2 cnl,,,
spam,As a Registered Subscriber yr draw 4 a å£100 gift voucher will b entered on receipt of a correct ans. When are the next olympics. Txt ans to 80062,,,
ham,You want to go? ,,,
ham,"Sorry, I'll call later",,,
ham,Really? I crashed out cuddled on my sofa.,,,
ham,Of cos can lar i'm not so ba dao ok... 1 pm lor... Y u never ask where we go ah... I said u would ask on fri but he said u will ask today...,,,
ham,"Wow. I never realized that you were so embarassed by your accomodations. I thought you liked it, since i was doing the best i could and you always seemed so happy about \the cave\"". I'm sorry I didn't and don't have more to give. I'm sorry i offered. I'm sorry your room was so embarassing.""",,,
ham,"Hey, can you tell me blake's address? Carlos wanted me to meet him there but I got lost and he's not answering his phone",,,
ham,Pls go there today  &lt;#&gt; . I dont want any excuses,,,
ham,ÌÏ give me some time to walk there.,,,
ham,Depends on where u going lor.,,,
ham,"Since when, which side, any fever, any vomitin.",,,
ham,CHEERS LOU! YEAH WAS A GOODNITE SHAME U NEVA CAME! C YA GAILxx,,,
ham,Have a good evening! Ttyl,,,
ham,Sorry . I will be able to get to you. See you in the morning.,,,
ham,"'An Amazing Quote'' - \Sometimes in life its difficult to decide whats wrong!! a lie that brings a smile or the truth that brings a tear....\""""",,,
ham,"Haha... Where got so fast lose weight, thk muz go 4 a month den got effect... Gee,later we go aust put bk e weight.",,,
ham,"We know TAJ MAHAL as symbol of love. But the other lesser known facts 1. Mumtaz was Shahjahan's 4th wife, out of his 7 wifes. 2. Shahjahan killed Mumtaz's husband to marry her. 3. Mumtaz died in her  &lt;#&gt; th delivery. 4. He then married Mumtaz's sister. Question arises where the Hell is the LOVE?:-| -The Great Hari-",,,
ham,Yoyyooo u know how to change permissions for a drive in mac. My usb flash drive,,,
ham,Today my system sh get ready.all is well and i am also in the deep well,,,
ham,"I'm gonna be home soon and i don't want to talk about this stuff anymore tonight, k? I've cried enough today.",,,
ham,Uhhhhrmm isnt having tb test bad when youre sick,,,
ham,Ok good then i later come find Ì_... C lucky i told Ì_ to go earlier... Later pple take finish Ì_ no more again...,,,
ham,"sure, but make sure he knows we ain't smokin yet",,,
ham,Great. Have a safe trip. Dont panic surrender all.,,,
ham,Hope youåÕre not having too much fun without me!! see u tomorrow love jess x,,,
spam,"FREE2DAY sexy St George's Day pic of Jordan!Txt PIC to 89080 dont miss out, then every wk a saucy celeb!4 more pics c PocketBabe.co.uk 0870241182716 å£3/wk",,,
spam,Ваша заявка на кредит одобрена! 800000р под 0.1%! Получить: easycredit24.com,,,
ham,Забронировал столик на двоих на 19:00. Ресторан на Тверской,,,
ham,What's your room number again? Wanna make sure I'm knocking on the right door,,,
ham,Yo chad which gymnastics class do you wanna take? The site says Christians class is full..,,,
ham,I WILL CAL YOU SIR. In meeting,,,
ham,True dear..i sat to pray evening and felt so.so i sms'd you in some time...,,,
ham,Does she usually take fifteen fucking minutes to respond to a yes or no question,,,
ham,"K I'm ready,  &lt;#&gt; ?",,,
ham,Whats the staff name who is taking class for us?,,,
ham,IM GONNA MISS U SO MUCH,,,
ham,yes baby! I need to stretch open your pussy!,,,
ham,"Haha yeah I see that now, be there in a sec",,,
ham,says the  &lt;#&gt;  year old with a man and money. I'm down to my last  &lt;#&gt; . Still waiting for that check.,,,
ham,Hi where you. You in home or calicut?,,,
ham,Was just about to ask. Will keep this one. Maybe that's why you didn't get all the messages we sent you on glo,,,
ham,S da..al r above  &lt;#&gt;,,,
ham,"House-Maid is the murderer, coz the man was murdered on  &lt;#&gt; th January.. As public holiday all govt.instituitions are closed,including post office..understand?",,,
spam,Santa calling! Would your little ones like a call from Santa Xmas Eve? Call 09077818151 to book you time. Calls1.50ppm last 3mins 30s T&C www.santacalling.com,,,
ham,Shopping? Eh ger i toking abt syd leh...Haha,,,
ham,"I can't right this second, gotta hit people up first",,,
ham,Oh k k:)but he is not a big hitter.anyway good,,,
spam,"Hungry gay guys feeling hungry and up 4 it, now. Call 08718730555 just 10p/min. To stop texts call 08712460324 (10p/min)",,,
ham,Watching tv now. I got new job :),,,
ham,Already one guy loving you:-.,,,
ham,"Night has ended for another day, morning has come in a special way. May you smile like the sunny rays and leaves your worries at the blue blue bay.",,,
ham,U don't remember that old commercial?,,,
ham,"Детский сад сегодня не работает, оставь ребенка с бабушкой",,,
ham,"Yes, i'm small kid.. And boost is the secret of my energy..",,,
spam,Congratulations ur awarded 500 of CD vouchers or 125gift guaranteed & Free entry 2 100 wkly draw txt MUSIC to 87066,,,
ham,I borrow ur bag ok.,,,
ham,Excellent! Wish we were together right now!,,,
ham,I liked the new mobile,,,
ham,The bus leaves at  &lt;#&gt; ,,,
spam,U 447801259231 have a secret admirer who is looking 2 make contact with U-find out who they R*reveal who thinks UR so special-call on 09058094597,,,
ham,Anything lar...,,,
ham,Then any special there?,,,
ham,Good Morning my Dear........... Have a great &amp; successful day.,,,
ham,Wish i were with you now!,,,
ham,Today is ACCEPT DAY..U Accept me as? Brother Sister Lover Dear1 Best1 Clos1 Lvblefrnd Jstfrnd Cutefrnd Lifpartnr Belovd Swtheart Bstfrnd No rply means enemy,,,
ham,"Im sorry bout last nite it wasnåÕt ur fault it was me, spouse it was pmt or sumthin! U 4give me? I think u shldxxxx",,,
ham,"Sorry, I'll call later",,,
spam,Твой телефон выиграл 500GB интернета! Активируй: mobile-bonus.com,,,
ham,"I'll see, but prolly yeah",,,
spam,Burger King - Wanna play footy at a top stadium? Get 2 Burger King before 1st Sept and go Large or Super with Coca-Cola and walk out a winner,,,
ham,When u wana see it then,,,
ham,If you were/are free i can give. Otherwise nalla adi entey nattil kittum,,,
ham,I sent lanre fakeye's Eckankar details to the mail box,,,
ham,Anything lor... U decide...,,,
ham,This is wishing you a great day. Moji told me about your offer and as always i was speechless. You offer so easily to go to great lengths on my behalf and its stunning. My exam is next friday. After that i will keep in touch more. Sorry.,,,
spam,"URGENT. Important information for 02 user. Today is your lucky day! 2 find out why , log onto http://www.urawinner.com there is a fantastic surprise awaiting you !",,,
ham,"He said that he had a right giggle when he saw u again! You would possibly be the first person2die from NVQ, but think how much you could for! ",,,
ham,"Анализы в норме, врач сказал продолжать лечение",,,
ham,Why de. You looking good only:-)..,,,
ham,Sorry da thangam.it's my mistake.,,,
ham,"K give me a sec, breaking a  &lt;#&gt;  at cstore",,,
ham,I called and said all to him:)then he have to choose this future.,,,
spam,SUPER предложение! Загородный дом 500000р! Успей купить: dacha-sale.ru,,,
ham,Your account has been refilled successfully by INR  &lt;DECIMAL&gt; . Your KeralaCircle prepaid account balance is Rs  &lt;DECIMAL&gt; . Your Transaction ID is KR &lt;#&gt; .,,,
spam,"Latest Nokia Mobile or iPOD MP3 Player +å£400 proze GUARANTEED! Reply with: WIN to 83355 now! Norcorp Ltd.å£1,50/Mtmsgrcvd18+",,,
ham,Your bill at 3 is å£33.65 so thats not bad!,,,
spam,"Dear Matthew please call 09063440451 from a landline, your complimentary 4*Lux Tenerife holiday or å£1000 CASH await collection. ppm150 SAE T&Cs Box334 SK38XH.",,,
spam,SMS SERVICES For your inclusive text credits pls gotto www.comuk.net login 3qxj9 unsubscribe with STOP no extra charge help 08702840625 comuk.220cm2 9AE,,,
spam,Твой телефон выиграл 500GB интернета! Активируй: mobile-bonus.com,,,
ham,"Didn't try, g and I decided not to head out",,,
ham,Hahaha..use your brain dear,,,
ham,Are you angry with me. What happen dear,,,
ham,Hi' Test on  &lt;#&gt; rd ....,,,
ham,My love ... I hope your not doing anything drastic. Don't you dare sell your pc or your phone ...,,,
spam,New TEXTBUDDY Chat 2 horny guys in ur area 4 just 25p Free 2 receive Search postcode or at gaytextbuddy.com. TXT ONE name to 89693,,,
ham,2mro i am not coming to gym machan. Goodnight.,,,
ham,oh ya... Got hip hop open. Haha i was thinking can go for jazz then zoom to cine... Actually tonight i'm free leh... And there's a kb lesson tonight,,,
ham,Huh so late... Fr dinner?,,,
ham,You still around? I could use a half-8th,,,
ham,"Спасибо за консультацию, все очень помогло",,,
ham,I am on the way to ur home,,,
spam,"FREE RINGTONE text FIRST to 87131 for a poly or text GET to 87131 for a true tone! Help? 0845 2814032 16 after 1st free, tones are 3xå£150pw to eå£nd txt stop",,,
ham,Please attend the phone:),,,
ham,Didn't you get hep b immunisation in nigeria.,,,
ham,Well keep in mind I've only got enough gas for one more round trip barring a sudden influx of cash,,,
spam,ПОСЛЕДНИЙ ШАНС! Товары по 1 рублю! Только сегодня! Оформить: sale1rub.ru,,,
ham,"Sorry, left phone upstairs. OK, might be hectic but would be all my birds with one fell swoop. It's a date.",,,
ham,"Aldrine, rakhesh ex RTM here.pls call.urgent.",,,
ham,Не забудь про встречу с клиентом в четверг,,,
ham,Err... Cud do. I'm going to  at 8pm. I haven't got a way to contact him until then.,,,
ham,Got it..mail panren paru..,,,
spam,Заработок от 50000 рублей в день без вложений! Пиши в WhatsApp +7-XXX-XXX-XXXX,,,
ham,"Cool, we shall go and see, have to go to tip anyway. Are you at home, got something to drop in later? So lets go to town tonight! Maybe mum can take us in.",,,
ham,How are you. Its been ages. How's abj,,,
ham,"Sorry, I'll call later",,,
ham,Finally the match heading towards draw as your prediction.,,,
ham,Huh? 6 also cannot? Then only how many mistakes?,,,
ham,Just chill for another 6hrs. If you could sleep the pain is not a surgical emergency so see how it unfolds. Okay,,,
ham,I donno its in your genes or something,,,
ham,Yes. Last  practice,,,
spam,"You can stop further club tones by replying \STOP MIX\"" See my-tone.com/enjoy. html for terms. Club tones cost GBP4.50/week. MFL",,,
ham,I'm reading the text i just sent you. Its meant to be a joke. So read it in that light,,,
ham,Ew are you one of them?,,,
ham,"Hey chief, can you give me a bell when you get this. Need to talk to you about this royal visit on the 1st june. ",,,
ham,Uncle Abbey! Happy New Year. Abiola,,,
spam,АКЦИЯ! Квартиры в Москве от 1млн руб! Звоните прямо сейчас 8-XXX-XXX-XXXX,,,
ham,Should I be stalking u?,,,
spam,"Want to funk up ur fone with a weekly new tone reply TONES2U 2 this text. www.ringtones.co.uk, the original n best. Tones 3GBP network operator rates apply",,,
ham,"Dad wanted to talk about the apartment so I got a late start, omw now",,,
ham,"Fighting with the world is easy, u either win or lose bt fightng with some1 who is close to u is dificult if u lose - u lose if u win - u still lose.",,,
ham,"Hmmm.. Thk sure got time to hop ard... Ya, can go 4 free abt... Muz call u to discuss liao... ",,,
ham,How are you enjoying this semester? Take care brother.,,,
ham,Pls help me tell Ashley that i cant find her number oh,,,
spam,Customer Loyalty Offer:The NEW Nokia6650 Mobile from ONLY å£10 at TXTAUCTION! Txt word: START to No: 81151 & get yours Now! 4T&Ctxt TC 150p/MTmsg,,,
ham,Buy one egg for me da..please:),,,
ham,"I'm eatin now lor, but goin back to work soon... E mountain deer show huh... I watch b4 liao, very nice...",,,
ham,if you text on your way to cup stop that should work. And that should be BUS,,,
spam,"Urgent! call 09061749602 from Landline. Your complimentary 4* Tenerife Holiday or å£10,000 cash await collection SAE T&Cs BOX 528 HP20 1YF 150ppm 18+",,,
ham,Your gonna have to pick up a $1 burger for yourself on your way home. I can't even move. Pain is killing me.,,,
ham,Oh yes I can speak txt 2 u no! Hmm. Did u get  email?,,,
ham,"OH RITE. WELL IM WITH MY BEST MATE PETE, WHO I WENT OUT WITH 4 A WEEK+ NOW WERE 2GEVA AGAIN. ITS BEEN LONGER THAN A WEEK.",,,
ham,"Argh my 3g is spotty, anyway the only thing I remember from the research we did was that province and sterling were the only problem-free places we looked at",,,
ham,Hi:)cts employee how are you?,,,
ham,As per your request 'Melle Melle (Oru Minnaminunginte Nurungu Vettam)' has been set as your callertune for all Callers. Press *9 to copy your friends Callertune,,,
ham,"Yo carlos, a few friends are already asking me about you, you working at all this weekend?",,,
ham,"Thanks again for your reply today. When is ur visa coming in. And r u still buying the gucci and bags. My sister things are not easy, uncle john also has his own bills so i really need to think about how to make my own money. Later sha.",,,
ham,"Do 1 thing! Change that sentence into: \Because i want 2 concentrate in my educational career im leaving here..\""""",,,
ham,Sometimes Heart Remembrs someone Very much... Forgets someone soon... Bcoz Heart will not like everyone. But liked ones will be Remembered Everytime... BSLVYL,,,
spam,"Do you realize that in about 40 years, we'll have thousands of old ladies running around with tattoos?",,,
ham,I dun believe u. I thk u told him.,,,
ham,Wot is u up 2 then bitch?,,,
ham,"Wen ur lovable bcums angry wid u, dnt take it seriously.. Coz being angry is d most childish n true way of showing deep affection, care n luv!.. kettoda manda... Have nice day da.",,,
ham,It is a good thing I'm now getting the connection to bw,,,
ham,Can not use foreign stamps in this country.,,,
ham,"Oh... Icic... K lor, den meet other day...",,,
ham,No problem with the renewal. I.ll do it right away but i dont know his details.,,,
ham,Your gonna be the death if me. I'm gonna leave a note that says its all robs fault. Avenge me.,,,
ham,"Haha awesome, be there in a minute",,,
spam,Dont forget you can place as many FREE Requests with 1stchoice.co.uk as you wish. For more Information call 08707808226.,,,
ham,Ugh fuck it I'm resubbing to eve,,,
ham,S.this will increase the chance of winning.,,,
ham,K..i deleted my contact that why?,,,
ham,May b approve panalam...but it should have more posts..,,,
ham,"Yo my trip got postponed, you still stocked up?",,,
ham,"Mum, i've sent you many many messages since i got here. I just want to know that you are actually getting them. Do enjoy the rest of your day.",,,
spam,"Mila, age23, blonde, new in UK. I look sex with UK guys. if u like fun with me. Text MTALK to 69866.18 . 30pp/txt 1st 5free. å£1.50 increments. Help08718728876",,,
ham,All e best 4 ur exam later.,,,
ham,What Today-sunday..sunday is holiday..so no work..,,,
ham,ÌÏ thk of wat to eat tonight.,,,
spam,Get the official ENGLAND poly ringtone or colour flag on yer mobile for tonights game! Text TONE or FLAG to 84199. Optout txt ENG STOP Box39822 W111WX å£1.50,,,
ham,"I know you are thinkin malaria. But relax, children cant handle malaria. She would have been worse and its gastroenteritis. If she takes enough to replace her loss her temp will reduce. And if you give her malaria meds now she will just vomit. Its a self limiting illness she has which means in a few days it will completely stop",,,
ham,What is your record for one night? :),,,
ham,U should make a fb list,,,
spam,PRIVATE! Your 2003 Account Statement for shows 800 un-redeemed S.I.M. points. Call 08715203685 Identifier Code:4xx26 Expires 13/10/04,,,
ham,"How's my loverboy doing ? What does he do that keeps him from coming to his Queen, hmmm ? Doesn't he ache to speak to me ? Miss me desparately ?",,,
ham,"Think i might have to give it a miss. Am teaching til twelve, then have lecture at two. Damn this working thing.",,,
spam,"Loan for any purpose å£500 - å£75,000. Homeowners + Tenants welcome. Have you been previously refused? We can still help. Call Free 0800 1956669 or text back 'help'",,,
ham,"It's fine, imma get a drink or somethin. Want me to come find you?",,,
ham,She just broke down a list of reasons why nobody's in town and I can't tell if she's being sarcastic or just faggy,,,
ham,Will you come online today night,,,
ham,Yar lor actually we quite fast... Cos da ge slow wat... Haha...,,,
ham,I was slept that time.you there?,,,
ham,Wow so healthy. Old airport rd lor. Cant thk of anything else. But i'll b bathing my dog later.,,,
spam,U have a secret admirer who is looking 2 make contact with U-find out who they R*reveal who thinks UR so special-call on 09058094599,,,
ham,As in different styles?,,,
ham,Pls go ahead with watts. I just wanted to be sure. Do have a great weekend. Abiola,,,
ham,"No i'm not. I can't give you everything you want and need. You actually could do better for yourself on yor own--you've got more money than i do. I can't get work, i can't get a man, i can't pay the rent, i can't even fill my fucking gas tank. yes, i'm stressed and depressed. I didn't even call home for thanksgiving cuz i'll have to tell them i,m up to nothing.",,,
ham,As if i wasn't having enough trouble sleeping.,,,
ham,I'm at work. Please call,,,
ham,U can call me now...,,,
ham,"I'm in a meeting, call me later at",,,
spam,Важное сообщение от банка! Необходимо обновить данные: secure-bank24.ru,,,
ham,Dai  &lt;#&gt;  naal eruku.,,,
ham,"So many people seems to be special at first sight, But only very few will remain special to you till your last sight.. Maintain them till life ends.. take cr da",,,
ham,"Trust me. Even if isn't there, its there.",,,
ham,You were supposed to wake ME up &gt;:(,,,
ham,Hey darlin.. i can pick u up at college if u tell me wen & where 2 mt.. love Pete xx,,,
ham,I dont. Can you send it to me. Plus how's mode.,,,
ham,I tot u reach liao. He said t-shirt.,,,
ham,Yeah if we do have to get a random dude we need to change our info sheets to PARTY  &lt;#&gt; /7 NEVER STUDY just to be safe,,,
ham,Your right! I'll make the appointment right now.,,,
ham,Or ill be a little closer like at the bus stop on the same street,,,
spam,"Steam: попытка покупки на 5000р. Если это не вы, отменить: steam-cancel.org",,,
ham,"Gosh that , what a pain. Spose I better come then.",,,
