v1,v2,v3,v4,v5
ham,Even i cant close my eyes you are in me our vava playing umma :-D,,,
ham,Hi Princess! Thank you for the pics. You are very pretty. How are you?,,,
ham,"We're all getting worried over here, derek and taylor have already assumed the worst",,,
ham,"Sir, hope your day is going smoothly. i really hoped i wont have to bother you about this. I have some bills that i can't settle this month. I am out of all extra cash. I know this is a challenging time for you also but i have to let you know.",,,
ham,You should change your fb to jaykwon thuglyfe falconerf,,,
ham,"Just gettin a bit arty with my collages at the mo, well tryin 2 ne way! Got a roast in a min lovely i shall enjoy that!",,,
ham,"Just sent again. Do you scream and moan in bed, princess?",,,
ham,Does uncle timi help in clearing cars,,,
spam,"FreeMSG You have been awarded a FREE mini DIGITAL CAMERA, just reply SNAP to collect your prize! (quizclub Opt out? Stop 80122300p/wk SP:RWM Ph:08704050406)",,,
ham,As per your request 'Melle Melle (Oru Minnaminunginte Nurungu Vettam)' has been set as your callertune for all Callers. Press *9 to copy your friends Callertune,,,
ham,That's significant but dont worry.,,,
ham,"\I;m reaching in another 2 stops.\""""",,,
ham,"\The world suffers a lot... Not because of the violence of bad people. But because of the silence of good people!\""",,,
ham,S:)8 min to go for lunch:),,,
ham,Sorry i missed your call. Can you please call back.,,,
ham,Msg me when rajini comes.,,,
ham,I know she called me,,,
spam,Valentines Day Special! Win over å£1000 in our quiz and take your partner on the trip of a lifetime! Send GO to 83600 now. 150p/msg rcvd. CustCare:08718720201,,,
ham,"Hi, can i please get a  &lt;#&gt;  dollar loan from you. I.ll pay you back by mid february. Pls.",,,
ham,HI ITS JESS I DONT KNOW IF YOU ARE AT WORK BUT CALL ME WHEN U CAN IM AT HOME ALL EVE. XXX,,,
ham,No i am not having not any movies in my laptop,,,
ham,I wil be there with in  &lt;#&gt;  minutes. Got any space,,,
ham,Think I could stop by in like an hour or so? My roommate's looking to stock up for a trip,,,
ham,"I just got home babe, are you still awake ?",,,
ham,"Sorry pa, i dont knw who ru pa?",,,
ham,Omg Joanna is freaking me out. She's looked thru all my friends to find photos of me. And then she's asking about stuff on my MySpace which I haven't even logged on in like a year. :/,,,
ham,No other Valentines huh? The proof is on your fb page. Ugh I'm so glad I really DIDN'T watch your rupaul show you TOOL!,,,
ham,Dont put your phone on silent mode ok,,,
ham,No dear i do have free messages without any recharge. Hi hi hi,,,
spam,Поздравляем! Вам одобрен кредит до 500000 рублей без справок! Позвоните 8-800-XXX-XXXX,,,
ham,"Well done, blimey, exercise, yeah, i kinda remember wot that is, hmm. ",,,
spam,Reminder: You have not downloaded the content you have already paid for. Goto http://doit. mymoby. tv/ to collect your content.,,,
ham,"\OH FUCK. JUSWOKE UP IN A BED ON A BOATIN THE DOCKS. SLEPT WID 25 YEAR OLD. SPINOUT! GIV U DA GOSSIP L8R. XXX\""""",,,
ham,Whatsup there. Dont u want to sleep,,,
ham,"Hmmm ... I thought we said 2 hours slave, not 3 ... You are late ... How should I punish you ?",,,
ham,"Text me when you get off, don't call, my phones having problems",,,
spam,Вам доступен кредит 300000р под 0%! Оформить: credits-online.net,,,
ham,DO NOT B LATE LOVE MUM,,,
ham,You do got a shitload of diamonds though,,,
spam,Do you want a new Video phone? 600 anytime any network mins 400 Inclusive Video calls AND downloads 5 per week Free delTOMORROW call 08002888812 or reply NOW,,,
ham,Your dad is back in ph?,,,
ham,Lmao but its so fun...,,,
spam,ВНИМАНИЕ! Последний день акции! Товары даром! Забери бесплатно: free-stuff24.ru,,,
ham,So your telling me I coulda been your real Valentine and I wasn't? U never pick me for NOTHING!!,,,
ham,Dude we should go sup again,,,
ham,Well its not like you actually called someone a punto. That woulda been worse.,,,
ham,Please da call me any mistake from my side sorry da. Pls da goto doctor.,,,
ham,I'm good. Have you registered to vote?,,,
ham,"Alright we're hooked up, where you guys at",,,
ham,What Today-sunday..sunday is holiday..so no work..,,,
ham,"K, if u bored up just come to my home..",,,
ham,I not busy juz dun wan 2 go so early.. Hee.. ,,,
ham,Pls give her the food preferably pap very slowly with loads of sugar. You can take up to an hour to give it. And then some water. Very very slowly.,,,
ham,"Awesome, plan to get here any time after like  &lt;#&gt; , I'll text you details in a wee bit",,,
ham,Stupid.its not possible,,,
ham,We have pizza if u want,,,
ham,"HEY THERE BABE, HOW U DOIN? WOT U UP 2 2NITE LOVE ANNIE X.",,,
ham,I went to project centre,,,
spam,22 days to kick off! For Euro2004 U will be kept up to date with the latest news and results daily. To be removed send GET TXT STOP to 83222,,,
ham,Yar lor wait 4 my mum 2 finish sch then have lunch lor... I whole morning stay at home clean my room now my room quite clean... Hee...,,,
ham,ÌÏ bot notes oredi... Cos i juz rem i got...,,,
ham,Now project pa. After that only i can come.,,,
ham,Am not interested to do like that.,,,
ham,Have a nice day my dear.,,,
ham,"Sweetheart, hope you are not having that kind of day! Have one with loads of reasons to smile. Biola",,,
ham,You available now? I'm like right around hillsborough &amp;  &lt;#&gt; th,,,
spam,Free entry in 2 a weekly comp for a chance to win an ipod. Txt POD to 80182 to get entry (std txt rate) T&C's apply 08452810073 for details 18+,,,
ham,i see. When we finish we have loads of loans to pay,,,
ham,Erutupalam thandiyachu,,,
ham,Boy; I love u Grl: Hogolo Boy: gold chain kodstini Grl: Agalla Boy: necklace madstini Grl: agalla Boy: Hogli 1 mutai eerulli kodthini! Grl: I love U kano;-),,,
spam,"Eerie Nokia tones 4u, rply TONE TITLE to 8007 eg TONE DRACULA to 8007 Titles: GHOST, ADDAMSFA, MUNSTERS, EXORCIST, TWILIGHT www.getzed.co.uk POBox36504W45WQ 150p ",,,
ham,All sounds good. Fingers . Makes it difficult to type,,,
ham,Just sing HU. I think its also important to find someone female that know the place well preferably a citizen that is also smart to help you navigate through. Even things like choosing a phone plan require guidance. When in doubt ask especially girls.,,,
ham,Can you plz tell me the ans. BSLVYL sent via fullonsms.com,,,
ham,"Oh... Haha... Den we shld had went today too... Gee, nvm la... Kaiez, i dun mind goin jazz oso... Scared hiphop open cant catch up... ",,,
ham,Still i have not checked it da. . .,,,
spam,Our brand new mobile music service is now live. The free music player will arrive shortly. Just install on your phone to browse content from the top artists.,,,
ham,Or better still can you catch her and let ask her if she can sell  &lt;#&gt;  for me.,,,
ham,Gokila is talking with you aha:),,,
spam,You will recieve your tone within the next 24hrs. For Terms and conditions please see Channel U Teletext Pg 750,,,
ham,U still going to the mall?,,,
ham,Eat at old airport road... But now 630 oredi... Got a lot of pple...,,,
ham,"Night sweet, sleep well! I've just been to see The Exorcism of Emily Rose and may never sleep again! Hugs and snogs! ",,,
ham,"Living is very simple.. Loving is also simple.. Laughing is too simple.. Winning is tooo simple.. But, Being 'SIMPLE' is very difficult...;-) :-)",,,
ham,"What i mean was i left too early to check, cos i'm working a 9-6.",,,
ham,Can you open the door?,,,
ham,Where you. What happen,,,
spam,PRIVATE! Your 2003 Account Statement for 07753741225 shows 800 un-redeemed S. I. M. points. Call 08715203677 Identifier Code: 42478 Expires 24/10/04,,,
ham,"The guy at the car shop who was flirting with me got my phone number from the paperwork and called and texted me. I'm nervous because of course now he may have my address. Should i call his boss and tell him, knowing this may get him fired?",,,
spam,"Welcome to UK-mobile-date this msg is FREE giving you free calling to 08719839835. Future mgs billed at 150p daily. To cancel send \go stop\"" to 89123""",,,
ham,Dunno lei he neva say...,,,
ham,You're gonna have to be way more specific than that,,,
ham,"Sir, I need Velusamy sir's date of birth and company bank facilities details.",,,
ham,"Yeah we wouldn't leave for an hour at least, how's 4 sound?",,,
spam,"URGENT!! Your 4* Costa Del Sol Holiday or å£5000 await collection. Call 09050090044 Now toClaim. SAE, TC s, POBox334, Stockport, SK38xh, Costå£1.50/pm, Max10mins",,,
ham,Surly ill give it to you:-) while coming to review.,,,
ham,No drama Pls.i have had enough from you and family while i am struggling in the hot sun in a strange place.No reason why there should be an ego of not going 'IF NOT INVITED' when actually its necessity to go.wait for very serious reppurcussions.,,,
spam,"For ur chance to win a å£250 wkly shopping spree TXT: SHOP to 80878. T's&C's www.txt-2-shop.com custcare 08715705022, 1x150p/wk",,,
ham,Hey i will be late ah... Meet you at 945+,,,
ham,No da if you run that it activate the full version da.,,,
ham,Just seeing your missed call my dear brother. Do have a gr8 day.,,,
ham,"Hello my boytoy ... Geeee I miss you already and I just woke up. I wish you were here in bed with me, cuddling me. I love you ...",,,
ham,Thats cool. i liked your photos. You are very sexy!,,,
ham,dont make ne plans for nxt wknd coz she wants us to come down then ok,,,
ham,"We made it! Eta at taunton is 12:30 as planned, hope thatÛ÷s still okday?! Good to see you! :-xx",,,
ham,on hen night. Going with a swing,,,
ham,\Keep ur problems in ur heart,,,
ham,Hi. I'm sorry i missed your call. Can you pls call back.,,,
ham,Hope you are having a great day.,,,
ham,"Sweet, we may or may not go to 4U to meet carlos so gauge patty's interest in that",,,
ham,Yup i shd haf ard 10 pages if i add figures... ÌÏ all got how many pages?,,,
ham,"yeah, that's what I was thinking",,,
ham,Yep get with the program. You're slacking.,,,
ham,I'm also came to room.,,,
spam,"Hi ya babe x u 4goten bout me?' scammers getting smart..Though this is a regular vodafone no, if you respond you get further prem rate msg/subscription. Other nos used also. Beware!",,,
ham,I'm ok. Will do my part tomorrow,,,
spam,ТОЛЬКО СЕГОДНЯ! Новый iPhone за 5990 руб! Осталось 3 штуки! Заказать: iphone-sale.com,,,
spam,"Got what it takes 2 take part in the WRC Rally in Oz? U can with Lucozade Energy! Text RALLY LE to 61200 (25p), see packs or lucozade.co.uk/wrc & itcould be u!",,,
ham,Only once then after ill obey all yours.,,,
ham,I'm e person who's doing e sms survey...,,,
spam,Congratulations ur awarded either å£500 of CD gift vouchers & Free entry 2 our å£100 weekly draw txt MUSIC to 87066 TnCs www.Ldew.com 1 win150ppmx3age16,,,
ham,There r many model..sony ericson also der.. &lt;#&gt; ..it luks good bt i forgot modl no,,,
ham,Okay lor... Will they still let us go a not ah? Coz they will not know until later. We drop our cards into the box right?,,,
spam,Do you want a NEW video phone750 anytime any network mins 150 text for only five pounds per week call 08000776320 now or reply for delivery tomorrow,,,
ham,Good morning princess! Have a great day!,,,
ham,Wat makes u thk i'll fall down. But actually i thk i'm quite prone 2 falls. Lucky my dad at home i ask him come n fetch me already.,,,
ham,Talk With Yourself Atleast Once In A Day...!!! Otherwise You Will Miss Your Best FRIEND In This WORLD...!!! -Shakespeare- SHESIL  &lt;#&gt;,,,
ham,Draw va?i dont think so:),,,
ham,Hi! You just spoke to MANEESHA V. We'd like to know if you were satisfied with the experience. Reply Toll Free with Yes or No.,,,
ham,Ok. So april. Cant wait,,,
ham,"By the way, 'rencontre' is to meet again. Mountains dont....",,,
spam,Please CALL 08712402779 immediately as there is an urgent message waiting for you,,,
ham,Hey what how about your project. Started aha da.,,,
ham,I luv u soo much u donåÕt understand how special u r 2 me ring u 2morrow luv u xxx,,,
ham,"Motivate Behind every darkness, there is a shining light waiting for you to find it... Behind every best friend, there is always trust and love... BSLVYL",,,
ham,Ok anyway no need to change with what you said,,,
ham,U call me alter at 11 ok.,,,
ham,"Hi , where are you? We're at  and they're not keen to go out i kind of am but feel i shouldn't so can we go out tomo, don't mind do you?",,,
ham,Ambrith..madurai..met u in arun dha marrge..remembr?,,,
ham,Hey what's up charles sorry about the late reply.,,,
ham,Thank u!,,,
ham,Hurry home. Soup is DONE!,,,
ham,Thats cool. Where should i cum? On you or in you? :),,,
ham,I'm so in love with you. I'm excited each day i spend with you. You make me so happy.,,,
spam,Please call Amanda with regard to renewing or upgrading your current T-Mobile handset free of charge. Offer ends today. Tel 0845 021 3680 subject to T's and C's,,,
spam,Вам одобрена золотая карта! Лимит 1000000р! gold-card.com,,,
spam,"YOU VE WON! Your 4* Costa Del Sol Holiday or å£5000 await collection. Call 09050090044 Now toClaim. SAE, TC s, POBox334, Stockport, SK38xh, Costå£1.50/pm, Max10mins",,,
ham,ILL B DOWN SOON,,,
ham,For my family happiness..,,,
spam,"Shop till u Drop, IS IT YOU, either 10K, 5K, å£500 Cash or å£100 Travel voucher, Call now, 09064011000. NTT PO Box CR01327BT fixedline Cost 150ppm mobile vary",,,
ham,"My painful personal thought- \I always try to keep everybody happy all the time. But nobody recognises me when i am alone\""""",,,
ham,"I'll text carlos and let you know, hang on",,,
spam,Your 2004 account for 07XXXXXXXXX shows 786 unredeemed points. To claim call 08719181259 Identifier code: XXXXX Expires 26.03.05,,,
ham,"Sorry that took so long, omw now",,,
ham,"Den only weekdays got special price... Haiz... Cant eat liao... Cut nails oso muz wait until i finish drivin wat, lunch still muz eat wat... ",,,
spam,СРОЧНАЯ РАСПРОДАЖА! Бытовая техника даром! Забирай: tech-free.com,,,
ham,Wat happened to the cruise thing,,,
ham,"Haha I heard that, text me when you're around",,,
ham,It's Ì© only $140 ard...Ìä rest all ard $180 at least...Which is Ì© price 4 Ì© 2 bedrm ($900),,,
ham,So u gonna get deus ex?,,,
ham,No. It's not pride. I'm almost  &lt;#&gt;  years old and shouldn't be takin money from my kid. You're not supposed to have to deal with this stuff. This is grownup stuff--why i don't tell you.,,,
ham,Today i'm not workin but not free oso... Gee... Thgt u workin at ur fren's shop ? ,,,
ham,Aiyah then i wait lor. Then u entertain me. Hee...,,,
ham,Ok...,,,
ham,My sister going to earn more than me da.,,,
ham,"Well imma definitely need to restock before thanksgiving, I'll let you know when I'm out",,,
ham,"Jolly good! By the way,  will give u tickets for sat eve 7.30. Speak before then x",,,
spam,"Free Msg: get Gnarls Barkleys \Crazy\"" ringtone TOTALLY FREE just reply GO to this message right now!""",,,
spam,Вам одобрена ипотека! Квартира без первого взноса! realty-credit.net,,,
ham,When Ì_ login dat time... Dad fetching Ì_ home now?,,,
ham,I (Career Tel) have added u as a contact on INDYAROCKS.COM to send FREE SMS. To remove from phonebook - sms NO to  &lt;#&gt;,,,
ham,Hi:)did you asked to waheeda fathima about leave?,,,
spam,Moby Pub Quiz.Win a å£100 High Street prize if u know who the new Duchess of Cornwall will be? Txt her first name to 82277.unsub STOP å£1.50 008704050406 SP Arrow,,,
ham,Does daddy have a bb now.,,,
ham,"Well, I was about to give up cos they all said no they didnÛ÷t do one nighters. I persevered and found one but it is very cheap so i apologise in advance. It is just somewhere to sleep isnt it?",,,
ham,I'm done...,,,
ham,tap & spile at seven. * Is that pub on gas st off broad st by canal. Ok?,,,
spam,Moby Pub Quiz.Win a å£100 High Street prize if u know who the new Duchess of Cornwall will be? Txt her first name to 82277.unsub STOP å£1.50 008704050406 SP,,,
ham,"1) Go to write msg 2) Put on Dictionary mode 3)Cover the screen with hand, 4)Press  &lt;#&gt; . 5)Gently remove Ur hand.. Its interesting..:)",,,
ham,You give us back my id proof and  &lt;#&gt;  rs. We wont allow you to work. We will come to your home within days,,,
ham,On ma way to school. Can you pls send me ashley's number,,,
ham,I know but you need to get hotel now. I just got my invitation but i had to apologise. Cali is to sweet for me to come to some english bloke's weddin,,,
ham,say thanks2. ,,,
ham,I think it's all still in my car,,,
ham,"As usual..iam fine, happy &amp; doing well..:)",,,
ham,And miss vday the parachute and double coins??? U must not know me very well...,,,
ham,Yo we are watching a movie on netflix,,,
ham,Kallis is ready for bat in 2nd innings,,,
ham,"&lt;#&gt; , that's all? Guess that's easy enough",,,
ham,I think asking for a gym is the excuse for lazy people. I jog.,,,
ham,Sleeping nt feeling well,,,
ham,Yup i thk so until e shop closes lor.,,,
ham,Why don't you wait 'til at least wednesday to see if you get your .,,,
ham,Are you the cutest girl in the world or what,,,
ham,Go chase after her and run her over while she's crossing the street,,,
ham,Good day to You too.Pray for me.Remove the teeth as its painful maintaining other stuff.,,,
spam,Call Germany for only 1 pence per minute! Call from a fixed line via access number 0844 861 85 85. No prepayment. Direct access! www.telediscount.co.uk,,,
ham,"Ветеринар сказал что кот здоров, просто простудился",,,
spam,Do you want 750 anytime any network mins 150 text and a NEW VIDEO phone for only five pounds per week call 08002888812 or reply for delivery tomorrow,,,
ham,If u sending her home first it's ok lor. I'm not ready yet.,,,
ham,I know a few people I can hit up and fuck to the yes,,,
ham,And I don't plan on staying the night but I prolly won't be back til late,,,
ham,K actually can you guys meet me at the sunoco on howard? It should be right on the way,,,
ham,Hey come online! Use msn... We are all there,,,
ham,"Yep, at derek's house now, see you Sunday &lt;3",,,
ham,"Oh yes, why is it like torture watching england?",,,
ham,"Frnd s not juz a word.....not merely a relationship.....its a silent promise which says ... \ I will be with YOU \"" Wherevr.. Whenevr.. Forevr... Gudnyt dear..""",,,
ham,How much would it cost to hire a hitman,,,
ham,"alright, I'll make sure the car is back tonight",,,
ham,Did u see what I posted on your Facebook?,,,
ham,Ard 6 like dat lor.,,,
ham,Yes i thought so. Thanks.,,,
ham,"[Û_] anyway, many good evenings to u! s",,,
ham,"Plz note: if anyone calling from a mobile Co. &amp; asks u to type # &lt;#&gt;  or # &lt;#&gt; . Do not do so. Disconnect the call,coz it iz an attempt of 'terrorist' to make use of the sim card no. Itz confirmd by nokia n motorola n has been verified by CNN IBN.",,,
ham,"Perhaps * is much easy give your account identification, so i will tomorrow at UNI",,,
ham,Are you wet right now?,,,
ham,"Haha, that was the first person I was gonna ask",,,
ham,Don know..wait i will check it.,,,
ham,"Yar lor he wan 2 go c horse racing today mah, so eat earlier lor. I ate chicken rice. U?",,,
ham,"Sorry, was in the bathroom, sup",,,
ham,Ok... I din get ur msg...,,,
ham,Ok I'm gonna head up to usf in like fifteen minutes,,,
ham,Thinkin about someone is all good. No drugs for that,,,
ham,"Now u sound like manky scouse boy steve,like! I is travelling on da bus home.wot has u inmind 4 recreation dis eve?",,,
ham,I wan but too early lei... Me outside now wun b home so early... Neva mind then...,,,
ham,I don't want you to leave. But i'm barely doing what i can to stay sane. fighting with you constantly isn't helping.,,,
ham,I'm already back home so no probably not,,,
ham,jay says he'll put in  &lt;#&gt;,,,
spam,Camera - You are awarded a SiPix Digital Camera! call 09061221066 fromm landline. Delivery within 28 days.,,,
ham,Hi babe its me thanks for coming even though it didnt go that well!i just wanted my bed! Hope to see you soon love and kisses xxx,,,
spam,"As a valued customer, I am pleased to advise you that following recent review of your Mob No. you are awarded with a å£1500 Bonus Prize, call 09066364589",,,
spam,"Bears Pic Nick, and Tom, Pete and ... Dick. In fact, all types try gay chat with photo upload call 08718730666 (10p/min). 2 stop texts call 08712460324",,,
ham,Haha mayb u're rite... U know me well. Da feeling of being liked by someone is gd lor. U faster go find one then all gals in our group attached liao.,,,
ham,Merry christmas to u too annie!,,,
ham,I want snow. It's just freezing and windy.,,,
spam,PRIVATE! Your 2003 Account Statement for 07808 XXXXXX shows 800 un-redeemed S. I. M. points. Call 08719899217 Identifier Code: 41685 Expires 07/11/04,,,
ham,"Don't worry, * is easy once have ingredients!",,,
ham,Oh:)as usual vijay film or its different?,,,
ham,Not a lot has happened here. Feels very quiet. Beth is at her aunts and charlie is working lots. Just me and helen in at the mo. How have you been? ,,,
ham,Then she buying today? ÌÏ no need to c meh...,,,
ham,"A famous quote : when you develop the ability to listen to 'anything' unconditionally without losing your temper or self confidence, it means you are ......... 'MARRIED'",,,
ham,Been up to ne thing interesting. Did you have a good birthday? When are u wrking nxt? I started uni today.,,,
ham,Good morning princess! How are you?,,,
ham,"Собираемся в субботу на шашлыки, присоединяйтесь!",,,
ham,"The sign of maturity is not when we start saying big things.. But actually it is, when we start understanding small things... *HAVE A NICE EVENING* BSLVYL",,,
ham,Sad story of a Man - Last week was my b'day. My Wife did'nt wish me. My Parents forgot n so did my Kids . I went to work. Even my Colleagues did not wish.,,,
ham,ÌÏ ready then call me...,,,
ham,You dont know you jabo me abi.,,,
ham,Yes..gauti and sehwag out of odi series.,,,
ham,I sent them. Do you like?,,,
ham,Excellent! Are you ready to moan and scream in ecstasy?,,,
ham,Ok thanx...,,,
ham,"Завтра праздник, офис не работает",,,
ham,Sweet heart how are you?,,,
ham,"Alright if you're sure, let me know when you're leaving",,,
spam,You have WON a guaranteed å£1000 cash or a å£2000 prize. To claim yr prize call our customer service representative on 08714712412 between 10am-7pm Cost 10p,,,
ham,Been running but only managed 5 minutes and then needed oxygen! Might have to resort to the roller option!,,,
ham,Convey my regards to him,,,
ham,Purity of friendship between two is not about smiling after reading the forwarded message..Its about smiling just by seeing the name. Gud evng,,,
ham,Родители приезжают в гости на выходные,,,
spam,WINNER!! As a valued network customer you have been selected to receivea å£900 prize reward! To claim call 09061701461. Claim code KL341. Valid 12 hours only.,,,
ham,We can go 4 e normal pilates after our intro...  ,,,
ham,No way I'm going back there!,,,
ham,Its a great day. Do have yourself a beautiful one.,,,
ham,"Haven't seen my facebook, huh? Lol!",,,
ham,No we sell it all so we'll have tons if coins. Then sell our coins to someone thru paypal. Voila! Money back in life pockets:),,,
ham,You tell what happen dont behave like this to me. Ok no need to say,,,
spam,Please call our customer service representative on FREEPHONE 0808 145 4742 between 9am-11pm as you have WON a guaranteed å£1000 cash or å£5000 prize!,,,
ham,Lol yes. But it will add some spice to your day.,,,
ham,She left it very vague. She just said she would inform the person in accounting about the delayed rent and that i should discuss with the housing agency about my renting another place. But checking online now and all places around usc are  &lt;#&gt;  and up,,,
ham,Moji i love you more than words. Have a rich day,,,
spam,"Thanks for your ringtone order, ref number R836. Your mobile will be charged å£4.50. Should your tone not arrive please call customer services on 09065069154",,,
ham,I don't know jack shit about anything or i'd say/ask something helpful but if you want you can pretend that I did and just text me whatever in response to the hypotheticalhuagauahahuagahyuhagga,,,
ham,"Ребенок заболел, завтра не пойдет в школу",,,
ham,Is there any movie theatre i can go to and watch unlimited movies and just pay once?,,,
spam,"Xmas & New Years Eve tickets are now on sale from the club, during the day from 10am till 8pm, and on Thurs, Fri & Sat night this week. They're selling fast!",,,
ham,In the end she might still vomit but its okay. Not everything will come out.,,,
ham,I've got it down to a tea. not sure which flavour,,,
spam,"Will u meet ur dream partner soon? Is ur career off 2 a flyng start? 2 find out free, txt HORO followed by ur star sign, e. g. HORO ARIES",,,
ham,Just buy a pizza. Meat lovers or supreme. U get to pick.,,,
ham,"Goodmorning, today i am late for 1hr.",,,
spam,Free 1st week entry 2 TEXTPOD 4 a chance 2 win 40GB iPod or å£250 cash every wk. Txt VPOD to 81303 Ts&Cs www.textpod.net custcare 08712405020.,,,
spam,YOU ARE CHOSEN TO RECEIVE A å£350 AWARD! Pls call claim number 09066364311 to collect your award which you are selected to receive as a valued mobile customer.,,,
ham,Darren was saying dat if u meeting da ge den we dun meet 4 dinner. Cos later u leave xy will feel awkward. Den u meet him 4 lunch lor.,,,
ham,Actually getting ready to leave the house.,,,
ham,And popping &lt;#&gt; ibuprofens was no help.,,,
ham,meet you in corporation st outside gap Û_ you can see how my mind is working!,,,
ham,Aiyar sorry lor forgot 2 tell u...,,,
ham,Why are u up so early?,,,
