v1,v2,v3,v4,v5
ham,Probably earlier than that if the station's where I think it is,,,
ham,He says hi and to get your ass back to south tampa (preferably at a kegger),,,
spam,18 days to Euro2004 kickoff! U will be kept informed of all the latest news and results daily. Unsubscribe send GET EURO STOP to 83222.,,,
ham,"Sorry, I'll call later",,,
ham,I'm leaving my house now...,,,
ham,WHEN THE FIRST STRIKE IS A RED ONE. THE BIRD + ANTELOPE BEGIN TOPLAY IN THE FIELDOF SELFINDEPENDENCE BELIEVE THIS + THE FLOWER OF CONTENTION WILL GROW.RANDOM!,,,
ham,Then Ì_ come n pick me at 530 ar?,,,
ham,Ok thanx... Take care then...,,,
ham,I have no idea where you are,,,
ham,"You know, wot people wear. T shirts, jumpers, hat, belt, is all we know. We r at Cribbs",,,
spam,"Urgent! call 09066612661 from landline. Your complementary 4* Tenerife Holiday or å£10,000 cash await collection SAE T&Cs PO Box 3 WA14 2PX 150ppm 18+ Sender: Hol Offer",,,
ham,Just wanted to say holy shit you guys weren't kidding about this bud,,,
ham,Mmmm ... Fuck ... Not fair ! You know my weaknesses ! *grins* *pushes you to your knee's* *exposes my belly and pulls your head to it* Don't forget ... I know yours too *wicked smile*,,,
ham,"My friend, she's studying at warwick, we've planned to go shopping and to concert tmw, but it may be canceled, havn't seen  for ages, yeah we should get together sometime!",,,
ham,Your opinion about me? 1. Over 2. Jada 3. Kusruthi 4. Lovable 5. Silent 6. Spl character 7. Not matured 8. Stylish 9. Simple Pls reply..,,,
ham,Tell them the drug dealer's getting impatient,,,
ham,Ya very nice. . .be ready on thursday,,,
ham,Did u got that persons story,,,
ham,First answer my question.,,,
spam,BIG BROTHER ALERT! The computer has selected u for 10k cash or #150 voucher. Call 09064018838. NTT PO Box CRO1327 18+ BT Landline Cost 150ppm mobiles vary,,,
ham,Hope you are having a great day.,,,
ham,Ok.,,,
ham,So how's scotland. Hope you are not over showing your JJC tendencies. Take care. Live the dream,,,
spam,Tone Club: Your subs has now expired 2 re-sub reply MONOC 4 monos or POLYC 4 polys 1 weekly @ 150p per week Txt STOP 2 stop This msg free Stream 0871212025016,,,
ham,yeah sure thing mate haunt got all my stuff sorted but im going sound anyway promoting hex for .by the way who is this? dont know number. Joke,,,
ham,Arun can u transfr me d amt,,,
ham,"Feb  &lt;#&gt;  is \I LOVE U\"" day. Send dis to all ur \""VALUED FRNDS\"" evn me. If 3 comes back u'll gt married d person u luv! If u ignore dis u will lose ur luv 4 Evr""",,,
ham,Now only i reached home. . . I am very tired now. . I will come tomorro,,,
ham,"Yeah go on then, bored and depressed sittin waitin for phone to ring... Hope the wind drops though, scary",,,
ham,Am I the only one who doesn't stalk profiles?,,,
ham,Taka lor. Wat time u wan 2 come n look 4 us?,,,
ham,"Ahhhh...just woken up!had a bad dream about u tho,so i dont like u right now :) i didnt know anything about comedy night but i guess im up for it.",,,
ham,Aiyo cos i sms Ì_ then Ì_ neva reply so i wait 4 Ì_ to reply lar. I tot Ì_ havent finish ur lab wat.,,,
spam,Ur HMV Quiz cash-balance is currently å£500 - to maximize ur cash-in now send HMV1 to 86688 only 150p/msg,,,
spam,U 447801259231 have a secret admirer who is looking 2 make contact with U-find out who they R*reveal who thinks UR so special-call on 09058094597,,,
ham,I want to go to perumbavoor,,,
ham,"Haha, just what I was thinkin",,,
spam,Ever thought about living a good life with a perfect partner? Just txt back NAME and AGE to join the mobile community. (100p/SMS),,,
ham,hope things went well at 'doctors' ;) reminds me i still need 2go.did u c d little thing i left in the lounge?,,,
ham,Oi. Ami parchi na re. Kicchu kaaj korte iccha korche na. Phone ta tul na. Plz. Plz.,,,
ham,In sch but neva mind u eat 1st lor..,,,
ham,"Honey ? Sweetheart ? Darling ? Sexy buns ? Sugar plum ? Loverboy ? I miss you, boytoy ... *smacks your ass* Did you go to the gym too ?",,,
ham,Well if I'm that desperate I'll just call armand again,,,
ham,Am in gobi arts college,,,
ham,Воду отключат с 10 до 16 часов. Наберите заранее,,,
ham,2marrow only. Wed at  &lt;#&gt;  to 2 aha.,,,
ham,Love has one law; Make happy the person you love. In the same way friendship has one law; Never make ur friend feel alone until you are alive.... Gud night,,,
ham,No problem. How are you doing?,,,
ham,Sorry i cant take your call right now. It so happens that there r 2waxsto do wat you want. She can come and ill get her medical insurance. And she'll be able to deliver and have basic care. I'm currently shopping for the right medical insurance for her. So just give me til friday morning. Thats when i.ll see the major person that can guide me to the right insurance.,,,
ham,Xy trying smth now. U eat already? We havent...,,,
ham,I forgot 2 ask Ì_ all smth.. There's a card on da present lei... How? ÌÏ all want 2 write smth or sign on it?,,,
spam,URGENT! We are trying to contact U. Todays draw shows that you have won a å£800 prize GUARANTEED. Call 09050003091 from land line. Claim C52. Valid 12hrs only,,,
ham,I will treasure every moment we spend together...,,,
ham,I also thk too fast... Xy suggest one not me. U dun wan it's ok. Going 2 rain leh where got gd.,,,
spam,You have an important customer service announcement from PREMIER.,,,
ham,If you r @ home then come down within 5 min,,,
ham,All boys made fun of me today. Ok i have no problem. I just sent one message just for fun,,,
ham,When/where do I pick you up,,,
spam,"Thanks for your ringtone order, ref number K718. Your mobile will be charged å£4.50. Should your tone not arrive please call customer services on 09065069120",,,
spam,"REMINDER FROM O2: To get 2.50 pounds free call credit and details of great offers pls reply 2 this text with your valid name, house no and postcode",,,
ham,We still on for tonight?,,,
ham,I dont have any of your file in my bag..i was in work when you called me.i 'll tell you if i find anything in my room.,,,
ham,Dont hesitate. You know this is the second time she has had weakness like that. So keep i notebook of what she eat and did the day before or if anything changed the day before so that we can be sure its nothing,,,
ham,Oh yeah! And my diet just flew out the window,,,
ham,I will be outside office take all from there,,,
ham,"How about clothes, jewelry, and trips?",,,
ham,Done it but internet connection v slow and canÛ÷t send it. Will try again later or first thing tomo.,,,
spam,HMV BONUS SPECIAL 500 pounds of genuine HMV vouchers to be won. Just answer 4 easy questions. Play Now! Send HMV to 86688 More info:www.100percent-real.com,,,
ham,Yes. They replied my mail. I'm going to the management office later. Plus will in to bank later also.or on wednesday.,,,
ham,"Edison has rightly said, \A fool can ask more questions than a wise man can answer\"" Now you know why all of us are speechless during ViVa.. GM",,,
spam,Knock Knock Txt whose there to 80082 to enter r weekly draw 4 a å£250 gift voucher 4 a store of yr choice. T&Cs www.tkls.com age16 to stoptxtstopå£1.50/week,,,
ham,"Nope. Since ayo travelled, he has forgotten his guy",,,
ham,"Sorry, I can't help you on this.",,,
spam,it to 80488. Your 500 free text messages are valid until 31 December 2005.,,,
ham,I'll reach in ard 20 mins ok...,,,
ham,How much did ur hdd casing cost.,,,
spam,"URGENT, IMPORTANT INFORMATION FOR O2 USER. TODAY IS YOUR LUCKY DAY! 2 FIND OUT WHY LOG ONTO HTTP://WWW.URAWINNER.COM THERE IS A FANTASTIC SURPRISE AWAITING FOR YOU",,,
ham,Horrible bf... I now v hungry...,,,
spam,We tried to contact you re your reply to our offer of a Video Phone 750 anytime any network mins Half Price Line Rental Camcorder Reply or call 08000930705,,,
ham,"No, I decided that only people who care about stuff vote and caring about stuff is for losers",,,
ham,Great escape. I fancy the bridge but needs her lager. See you tomo ,,,
ham,I agree. So i can stop thinkin about ipad. Can you please ask macho the same question.,,,
ham,"Посылка пришла на почту, можешь забрать с 9 до 18",,,
spam,"Had your contract mobile 11 Mnths? Latest Motorola, Nokia etc. all FREE! Double Mins & Text on Orange tariffs. TEXT YES for callback, no to remove from records.",,,
ham,Its sarcasm.. .nt scarcasim,,,
ham,He remains a bro amongst bros,,,
ham,I have a sore throat. It's scratches when I talk,,,
spam,Dear 0776xxxxxxx U've been invited to XCHAT. This is our final attempt to contact u! Txt CHAT to 86688 150p/MsgrcvdHG/Suite342/2Lands/Row/W1J6HL LDN 18yrs ,,,
ham,Horrible u eat macs eat until u forgot abt me already rite... U take so long 2 reply. I thk it's more toot than b4 so b prepared. Now wat shall i eat?,,,
ham,I'm still looking for a car to buy. And have not gone 4the driving test yet.,,,
ham,"Haha figures, well I found the piece and priscilla's bowl",,,
ham,Well. Balls. Time to make calls,,,
ham,"you are sweet as well, princess. Please tell me your likes and dislikes in bed...",,,
ham,"I think your mentor is , but not 100 percent sure.",,,
ham,"Thank you so much. When we skyped wit kz and sura, we didnt get the pleasure of your company. Hope you are good. We've given you ultimatum oh! We are countin down to aburo. Enjoy!",,,
ham,"I'm there and I can see you, but you can't see me ? Maybe you should reboot ym ? I seen the buzz",,,
ham,My uncles in Atlanta. Wish you guys a great semester.,,,
ham,"Turns out my friends are staying for the whole show and won't be back til ~ &lt;#&gt; , so feel free to go ahead and smoke that $ &lt;#&gt;  worth",,,
ham,"I think IÛ÷m waiting for the same bus! Inform me when you get there, if you ever get there.",,,
spam,"Download as many ringtones as u like no restrictions, 1000s 2 choose. U can even send 2 yr buddys. Txt Sir to 80082 å£3 ",,,
ham,"Neither [in sterm voice] - i'm studying. All fine with me! Not sure the  thing will be resolved, tho. Anyway. Have a fab hols",,,
ham,Ard 4 lor...,,,
ham,"Sorry, I'll call later",,,
ham,Lol ... I knew that .... I saw him in the dollar store,,,
ham,Very hurting n meaningful lines ever: \I compromised everything for my love,,,
ham,"Hello, my love. What are you doing? Did you get to that interview today? Are you you happy? Are you being a good boy? Do you think of me?Are you missing me ?",,,
ham,I dont thnk its a wrong calling between us,,,
ham,"Sorry, I'll call later In meeting.",,,
ham,"Wishing you and your family Merry \X\"" mas and HAPPY NEW Year in advance..""",,,
ham,"Happy or sad , one thing about past is- \Its no more\"" GOOD MORNING :-):-).""",,,
ham,Ok both our days. So what are you making for dinner tonite? Am I invited?,,,
ham,Dear how is chechi. Did you talk to her,,,
ham,"Good morning, my boytoy! How's those yummy lips ? Where's my sexy buns now ? What do you do ? Do you think of me ? Do you crave me ? Do you need me ?",,,
ham,"Sorry, I'll call later",,,
ham,Then its most likely called Mittelschmertz. Google it. If you dont have paracetamol dont worry it will go.,,,
ham,great princess! I love giving and receiving oral. Doggy style is my fave position. How about you? I enjoy making love  &lt;#&gt;  times per night :),,,
ham,Kothi print out marandratha.,,,
spam,Требуются люди для удаленной работы! 200000р в месяц! work-remote.net,,,
ham,Apo all other are mokka players only,,,
ham,"I can. But it will tell quite long, cos i haven't finish my film yet...",,,
ham,No. I dont want to hear anything,,,
ham,Hey i've booked the 2 lessons on sun liao...,,,
ham,"Sorry,in meeting I'll call later",,,
spam,This is the 2nd time we have tried to contact u. U have won the å£1450 prize to claim just call 09053750005 b4 310303. T&Cs/stop SMS 08718725756. 140ppm,,,
ham,I might go 2 sch. Yar at e salon now v boring.,,,
ham,Sounds better than my evening im just doing my costume. Im not sure what time i finish tomorrow but i will txt you at the end.,,,
ham,How i noe... She's in da car now... Later then c lar... I'm wearing shorts...,,,
ham,Life spend with someone for a lifetime may be meaningless but a few moments spent with someone who really love you means more than life itself..,,,
ham,"Awesome, text me when you're restocked",,,
ham,I.ll give her once i have it. Plus she said grinule greet you whenever we speak,,,
ham,What to think no one saying clearly. Ok leave no need to ask her. I will go if she come or not,,,
ham,I like cheap! But iÛ÷m happy to splash out on the wine if it makes you feel better..,,,
ham,Pls ask macho how much is budget for bb bold 2 is cos i saw a new one for  &lt;#&gt;  dollars.,,,
ham,Bring it if you got it,,,
ham,How's it feel? Mr. Your not my real Valentine just my yo Valentine even tho u hardly play!!,,,
ham,I cant keep talking to people if am not sure i can pay them if they agree to price. So pls tell me what you want to really buy and how much you are willing to pay,,,
ham,We took hooch for a walk toaday and i fell over! Splat! Grazed my knees and everything! Should have stayed at home! See you tomorrow! ,,,
ham,I am late. I will be there at,,,
ham,"Cool, text me when you head out",,,
ham,ÌÏ log off 4 wat. It's sdryb8i,,,
ham,Yup but not studying surfing lor. I'm in e lazy mode today.,,,
ham,Come by our room at some point so we can iron out the plan for this weekend,,,
ham,Is there a reason we've not spoken this year? Anyways have a great week and all the best in your exam,,,
ham,No problem. Talk to you later,,,
ham,One of best dialogue in cute reltnship..!! \Wen i Die,,,
ham,Spending new years with my brother and his family. Lets plan to meet next week. Are you ready to be spoiled? :),,,
ham,I REALLY NEED 2 KISS U I MISS U MY BABY FROM UR BABY 4EVA,,,
ham,So i could kiss and feel you next to me...,,,
spam,ЭКСКЛЮЗИВНОЕ предложение! Бизнес под ключ! Окупаемость за месяц! biz-start.com,,,
ham,ÌÏ eatin later but i'm eatin wif my frens now lei... ÌÏ going home first? ,,,
ham,I have lost 10 kilos as of today!,,,
ham,I HAVE A DATE ON SUNDAY WITH WILL!!,,,
ham,I guess it is useless calling u 4 something important.,,,
ham,"K, can that happen tonight?",,,
ham,Haven't heard anything and he's not answering my texts so I'm guessing he flaked. That said the jb is fantastic,,,
ham,"Found it, ENC  &lt;#&gt; , where you at?",,,
ham,"Спасибо за рекомендацию, обязательно попробую",,,
ham,Okie Ì_ wan meet at bishan? Cos me at bishan now. I'm not driving today.,,,
spam,URGENT! We are trying to contact U. Todays draw shows that you have won a å£800 prize GUARANTEED. Call 09050001295 from land line. Claim A21. Valid 12hrs only,,,
ham,"I don't think I can get away for a trek that long with family in town, sorry",,,
ham,when you and derek done with class?,,,
ham,There is os called ubandu which will run without installing in hard disk...you can use that os to copy the important files in system and give it to repair shop..,,,
ham,Wat's my dear doing? Sleeping ah?,,,
ham,"Come around  &lt;DECIMAL&gt; pm vikky..i'm otside nw, il come by tht time",,,
ham,Sad story of a Man - Last week was my b'day. My Wife did'nt wish me. My Parents forgot n so did my Kids . I went to work. Even my Colleagues did not wish.,,,
ham,Yetunde i'm in class can you not run water on it to make it ok. Pls now.,,,
ham,I'm stuck in da middle of da row on da right hand side of da lt... ,,,
ham,I dont thnk its a wrong calling between us,,,
ham,yay! finally lol. i missed our cinema trip last week :-(,,,
ham,"Hi frnd, which is best way to avoid missunderstding wit our beloved one's?",,,
ham,"Coffee cake, i guess...",,,
spam,"As a valued customer, I am pleased to advise you that following recent review of your Mob No. you are awarded with a å£1500 Bonus Prize, call 09066364589",,,
ham,We left already we at orchard now.,,,
spam,FreeMsg Hi baby wow just got a new cam moby. Wanna C a hot pic? or Fancy a chat?Im w8in 4uTxt / rply CHAT to 82242 Hlp 08712317606 Msg150p 2rcv,,,
ham,"I'm not coming over, do whatever you want",,,
ham,Its not the same here. Still looking for a job. How much do Ta's earn there.,,,
ham,Great! I shoot big loads so get ready!,,,
ham,Oh yeah clearly it's my fault,,,
ham,Headin towards busetop,,,
ham,Sent me de webadres for geting salary slip,,,
spam,"Auction round 4. The highest bid is now å£54. Next maximum bid is å£71. To bid, send BIDS e. g. 10 (to bid å£10) to 83383. Good luck.",,,
ham,Let me know how it changes in the next 6hrs. It can even be appendix but you are out of that age range. However its not impossible. So just chill and let me know in 6hrs,,,
spam,You are a winner U have been specially selected 2 receive å£1000 cash or a 4* holiday (flights inc) speak to a live operator 2 claim 0871277810810,,,
ham,Did you get any gift? This year i didnt get anything. So bad,,,
ham,Were somewhere on Fredericksburg,,,
ham,"Haha awesome, I've been to 4u a couple times. Who all's coming?",,,
ham,"And that's fine, I got enough bud to last most of the night at least",,,
ham,"I wake up long ago already... Dunno, what other thing?",,,
spam,I don't know u and u don't know me. Send CHAT to 86688 now and let's find each other! Only 150p/Msg rcvd. HG/Suite342/2Lands/Row/W1J6HL LDN. 18 years or over.,,,
ham,"There're some people by mu, I'm at the table by lambda",,,
ham,My uncles in Atlanta. Wish you guys a great semester.,,,
ham,Rofl betta invest in some  anti aging products,,,
ham,I dont have i shall buy one dear,,,
ham,Send me your id and password,,,
ham,Ok. Every night take a warm bath drink a cup of milk and you'll see a work of magic. You still need to loose weight. Just so that you know,,,
ham,Lol ... I really need to remember to eat when I'm drinking but I do appreciate you keeping me company that night babe *smiles*,,,
ham,Ok no prob...,,,
ham,Thank you. do you generally date the brothas?,,,
ham,"That's cool, I'll come by like  &lt;#&gt; ish",,,
ham,"Анализы в норме, врач сказал продолжать лечение",,,
ham,hi baby im sat on the bloody bus at the mo and i wont be home until about 7:30 wanna do somethin later? call me later ortxt back jess xx,,,
ham,Where are you ? What are you doing ? Are yuou working on getting the pc to your mom's ? Did you find a spot that it would work ? I need you,,,
ham,Are you planning to come chennai?,,,
ham,Lol no. U can trust me.,,,
ham,When can Ì_ come out?,,,
spam,TheMob>Yo yo yo-Here comes a new selection of hot downloads for our members to get for FREE! Just click & open the next link sent to ur fone...,,,
ham,"K I'll head out in a few mins, see you there",,,
ham,I thk 50 shd be ok he said plus minus 10.. Did Ì_ leave a line in between paragraphs?,,,
spam,Вконтакте: попытка входа с нового устройства. Если это не вы: vk-security.org,,,
ham,"Aight, you close by or still down around alex's place?",,,
ham,So do you have samus shoulders yet,,,
ham,"Hm good morning, headache anyone? :-)",,,
ham,Yup i've finished c Ì_ there...,,,
ham,Wait.i will come out.. &lt;#&gt;  min:),,,
ham,How long does it take to get it.,,,
ham,Happy new year. Hope you are having a good semester,,,
ham,I wnt to buy a BMW car urgently..its vry urgent.but hv a shortage of  &lt;#&gt; Lacs.there is no source to arng dis amt. &lt;#&gt; lacs..thats my prob,,,
ham,Yes i think so. I am in office but my lap is in room i think thats on for the last few days. I didnt shut that down,,,
ham,Aft i finish my lunch then i go str down lor. Ard 3 smth lor. U finish ur lunch already?,,,
ham,"Yeah there's quite a bit left, I'll swing by tomorrow when I get up",,,
ham,I wnt to buy a BMW car urgently..its vry urgent.but hv a shortage of  &lt;#&gt; Lacs.there is no source to arng dis amt. &lt;#&gt; lacs..thats my prob,,,
spam,Todays Vodafone numbers ending with 4882 are selected to a receive a å£350 award. If your number matches call 09064019014 to receive your å£350 award.,,,
ham,Btw regarding that we should really try to see if anyone else can be our 4th guy before we commit to a random dude,,,
ham,IÛ÷m parked next to a MINI!!!! When are you coming in today do you think?,,,
ham,DO U WANT 2 MEET UP 2MORRO,,,
spam,"This weeks SavaMob member offers are now accessible. Just call 08709501522 for details! SavaMob, POBOX 139, LA3 2WU. Only å£1.50/week. SavaMob - offers mobile!",,,
ham,Good night. Am going to sleep.,,,
ham,Its a valentine game. . . Send dis msg to all ur friends. .. If 5 answers r d same then someone really loves u. Ques- which colour suits me the best?rply me,,,
spam,As a registered optin subscriber ur draw 4 å£100 gift voucher will be entered on receipt of a correct ans to 80062 Whats No1 in the BBC charts,,,
spam,ВЫГОДА! Ремонт квартир под ключ 5000р за всю квартиру! remont-cheap.ru,,,
ham,Hey what are you doing. Y no reply pa..,,,
ham,Only if you promise your getting out as SOON as you can. And you'll text me in the morning to let me know you made it in ok.,,,
ham,"Извини что не ответил сразу, был на встрече",,,
ham,So why didnt you holla?,,,
ham,Oh k.k..where did you take test?,,,
ham,Just come home. I don't want u to be miserable,,,
ham,Who's there say hi to our drugdealer,,,
ham,The greatest test of courage on earth is to bear defeat without losing heart....gn tc,,,
spam,U have a Secret Admirer who is looking 2 make contact with U-find out who they R*reveal who thinks UR so special-call on 09065171142-stopsms-08,,,
ham,Ok.,,,
ham,"Probably, want to pick up more?",,,
ham,How do you plan to manage that,,,
ham,Aiyar u so poor thing... I give u my support k... Jia you! I'll think of u...,,,
ham,U having lunch alone? I now so bored...,,,
ham,I will come to ur home now,,,
ham,Are we doing the norm tomorrow? I finish just a 4.15 cos of st tests. Need to sort library stuff out at some point tomo - got letter from today - access til end march so i better get move on!,,,
ham,Уборка квартиры займет примерно 3 часа,,,
ham,Dont show yourself. How far. Put new pictures up on facebook.,,,
ham,Still i have not checked it da. . .,,,
spam,"XXXMobileMovieClub: To use your credit, click the WAP link in the next txt message or click here>> http://wap. xxxmobilemovieclub.com?n=QJKGIGHJJGCBL",,,
ham,Dis is yijue. I jus saw ur mail. In case huiming havent sent u my num. Dis is my num.,,,
ham,"Ya, i'm referin to mei's ex wat... No ah, waitin 4 u to treat, somebody shld b rich liao...So gd, den u dun have to work frm tmr onwards...",,,
ham,No calls..messages..missed calls,,,
ham,I'm home...,,,
ham,"Sorry, I'll call later",,,
ham,(You didn't hear it from me),,,
ham,Ok . . now i am in bus. . If i come soon i will come otherwise tomorrow,,,
ham,"7 wonders in My WORLD 7th You 6th Ur style 5th Ur smile 4th Ur Personality 3rd Ur Nature 2nd Ur SMS and 1st \Ur Lovely Friendship\""... good morning dear""",,,
ham,Ok. I only ask abt e movie. U wan ktv oso?,,,
ham,I am sorry it hurt you.,,,
ham,Have you bookedthe hut? And also your time off? How are you by the way?,,,
ham,make that 3! 4 fucks sake?! x,,,
ham,What you need. You have a person to give na.,,,
spam,YES! The only place in town to meet exciting adult singles is now in the UK. Txt CHAT to 86688 now! 150p/Msg.,,,
ham,You can never do NOTHING,,,
ham,Ok...,,,
ham,O was not into fps then.,,,
ham,No da. . Vijay going to talk in jaya tv,,,
ham,Thanks chikku..:-) gud nyt:-*,,,
ham,She.s good. She was wondering if you wont say hi but she.s smiling now. So how are you coping with the long distance,,,
spam,YOU HAVE WON! As a valued Vodafone customer our computer has picked YOU to win a å£150 prize. To collect is easy. Just call 09061743386,,,
ham,"Goodmorning, Today i am late for  &lt;#&gt; min.",,,
ham,Okay but i thought you were the expert,,,
ham,Long beach lor. Expected... U having dinner now?,,,
ham,An excellent thought by a misundrstud frnd: I knw u hate me bt the day wen u'll knw the truth u'll hate urself:-( Gn:-),,,
spam,"U can WIN å£100 of Music Gift Vouchers every week starting NOW Txt the word DRAW to 87066 TsCs www.Idew.com SkillGame, 1Winaweek, age16. 150ppermessSubscription",,,
spam,WINNER!! As a valued network customer you have been selected to receivea å£900 prize reward! To claim call 09061701461. Claim code KL341. Valid 12 hours only.,,,
ham,HELLO PEACH! MY CAKE TASTS LUSH!,,,
ham,HAPPY NEW YEAR MY NO.1 MAN,,,
spam,"Sunshine Hols. To claim ur med holiday send a stamped self address envelope to Drinks on Us UK, PO Box 113, Bray, Wicklow, Eire. Quiz Starts Saturday! Unsub Stop",,,
ham,"A boy was late 2 home. His father: \POWER OF FRNDSHIP\""""",,,
ham,"see, i knew giving you a break a few times woul lead to you always wanting to miss curfew. I was gonna gibe you 'til one, but a MIDNIGHT movie is not gonna get out til after 2. You need to come home. You need to getsleep and, if anything, you need to b studdying ear training.",,,
ham,Get down in gandhipuram and walk to cross cut road. Right side &lt;#&gt; street road and turn at first right.,,,
ham,Have a safe trip to Nigeria. Wish you happiness and very soon company to share moments with,,,
ham,So what do you guys do.,,,
ham,Its a valentine game. . . send dis msg to all ur friends. . If 5 answers r d same then someone really loves u. . Ques- which colour suits me the best?,,,
ham,Ok lor. I'm in town now lei.,,,
ham,For fear of fainting with the of all that housework you just did? Quick have a cuppa,,,
ham,"Good afternoon, my love. It was good to see your words on YM and get your tm. Very smart move, my slave ... *smiles* ... I drink my coffee and await you.",,,
spam,You have an important customer service announcement from PREMIER. Call FREEPHONE 0800 542 0578 now!,,,
ham,Okie... Thanx...,,,
ham,"U so lousy, run already come back then half dead... Hee...",,,
ham,What happen dear tell me,,,
